,subreddit,author,created_date,number_of_comments,upvotes,post
0,shittysuperpowers,t2_6k7ehywh,2020-09-28 14:54:35,0,1,You never forget to buy eggs at the grocery store  
1,shittysuperpowers,t2_3mr4ydvf,2020-09-28 13:46:00,2,7,You can assemble any object from atoms by the power of thought. It instantly blows up due to enormous energy required for this process  
2,shittysuperpowers,t2_3dbj9gpi,2020-09-28 13:21:37,0,4,You have small visions of a person who is visually impaired  
3,shittysuperpowers,t2_4ku4ofh1,2020-09-28 13:20:13,1,5,"Every time you sneeze, a random ant in a 50 meter radius of you dies  "
4,shittysuperpowers,t2_2vizqa9u,2020-09-28 13:12:35,0,7,"Everytime you ring a bell an angel gets their wings, chicken wings, that angel gets a plate of chicken wings  "
5,shittysuperpowers,t2_6d1atqg7,2020-09-28 12:53:42,3,9,You can make people hate you just by breathing in their vicinity  
6,shittysuperpowers,t2_35otf9vi,2020-09-28 12:52:04,4,29,"On every Tuesday, butter secretes from your ears and materializes into Gubulon Tavares, a flying goblin who will spend the next four hours and fifteen minutes heckling you about Netflix shows he wants you to watch and you absolutely can’t stand any of them because the plot lines are stupid.  "
7,shittysuperpowers,t2_13dl5zrh,2020-09-28 12:46:47,0,6,You can always find the exact half of a cup or bottle  
8,shittysuperpowers,t2_35p528fy,2020-09-28 11:55:34,0,5,"You have the ability to forcibly eject every individual strand of pubic hair found in your body. Akin to the media's depiction of porcupines, you have the ability to forcibly project your pubic hair across a short distance, with each individual strand having the appropriate amount of force to pierce through concrete walls."
9,shittysuperpowers,t2_bo8zf,2020-09-28 11:11:31,5,56,When you drunk you perspective changes to 3rd person.  
10,shittysuperpowers,t2_38hwna40,2020-09-28 10:50:32,1,7,You can change the size of boys penises only when they have sex  
11,shittysuperpowers,t2_146b4e,2020-09-28 10:18:09,0,6,"You can withdraw Pakistani Rupees from any cash machine in Nicaragua, as long as that cash machine is at least 10km from the closest currency exchange  "
12,shittysuperpowers,t2_5b8oxdg6,2020-09-28 10:06:21,1,5,"You can zap a brain cell from someone once per person. After that, the brain cell cannot be recovered."
13,shittysuperpowers,t2_3kzumk69,2020-09-28 09:52:47,8,250,"If you say ""Mamma mia"" while staring at a cheese pizza an invisible pineapple slice will appear on it  "
14,shittysuperpowers,t2_6hen34pn,2020-09-28 09:31:09,2,6,You're a master at roblox games  
15,shittysuperpowers,t2_1rehfz3m,2020-09-28 08:57:36,1,10,"If you witness someone dropping food or drink on themselves, the stain that results is always in the shape of a penis.  "
16,shittysuperpowers,t2_79cm8bam,2020-09-28 08:55:31,5,17,"You see text above people’s heads when you close your eyes, the text is what their thinking You can’t see while your eyes are closed so you have to open and close them to see who’s mind your reading"
17,shittysuperpowers,t2_178q23,2020-09-28 08:32:33,4,25,"When your angry you can summon a tiger, that will appear in a random location in the world.  "
18,shittysuperpowers,t2_5h5i27c,2020-09-28 07:54:09,3,1,"You can be the best at anything You can be the best at anything, but only by making everyone else worse at that thing"
19,shittysuperpowers,t2_1xl1h5ux,2020-09-28 07:42:39,1,2,You can transform corpses into chairs  
20,shittysuperpowers,t2_61ibq89d,2020-09-28 07:27:34,0,0,The smartest person in existance You can become the smartest person that has ever existed but only if you solve the hardest math problem in the world
21,shittysuperpowers,t2_158qon1l,2020-09-28 07:16:56,4,8,"You can fly like Superman, but only whilst masturbating."
22,shittysuperpowers,t2_158qon1l,2020-09-28 06:49:30,4,18,You can ejaculate molten lead.  
23,shittysuperpowers,t2_4iql0c7n,2020-09-28 06:46:59,1,6,"You can ignore scientific truths without cost to yourself It might be a common one, but it's still a shitty superpower that might end up killing us all..."
24,shittysuperpowers,t2_55owhc56,2020-09-28 06:36:35,0,0,"You can use your negative karma as currency (single unit note) in your country. Positive karma means you’re in debt. U.S. = $1 per downvote -$1 per upvote

U.K. = £1 per downvote -£1 per upvote 

Japan = ¥1 per downvote -¥1 per upvote

Etc 

Shitty because if you use this effectively you’ll become Reddit’s richest troll. We don’t need any more rich trolls in the world."
25,shittysuperpowers,t2_eu10o,2020-09-28 06:33:42,2,7,Everytime you grip something you have the power to grip it with 10% of your strength or 200% superhuman strength. You don't get to pick how much strength or when.  
26,shittysuperpowers,t2_55owhc56,2020-09-28 05:59:31,6,51,You can silence the sound of people eating.  
27,shittysuperpowers,t2_g76xe,2020-09-28 05:25:33,2,4,"You can reflect all light, though this doesn't turn you invisible just extremely shiny.  "
28,shittysuperpowers,t2_55owhc56,2020-09-28 04:45:56,1,3,"You act as a siphon between the overly obese and your favorite house pet. You can transfer any amount of fat from them to a single domesticated animal. Pretty cool because you can help people lose weight. Shitty because if you transfer too much you’ll kill your favorite pet and the death to fat ratio is probably pretty small. Either do it in small quantities or no pets for you. Sorry Fluffy. 

House pets include:

Dogs

Cats

Rodents

Reptiles 

And fish

You can transfer fat to more than one fish, since they live in the tank together, that’s how it works with fish. Plus, fat fish are hilarious. And no, you can’t have a fucking killer whale, that’s a mammal... they’ll eat you and hate being domesticated."
29,shittysuperpowers,t2_3ttzfkeo,2020-09-28 04:31:53,1,3,You can reverse people’s juice cleanses  
30,shittysuperpowers,t2_5632vcvh,2020-09-28 04:18:49,8,32,Every person who downvotes your post becomes genetically 0.01% closer to a potato.  
31,shittysuperpowers,t2_6k9hogh9,2020-09-28 04:10:35,2,12,"ANYTIME YOU SEE TEXT WITH ALL CAPS, YOU CAN FORGET IT WAS EVER THERE.  "
32,shittysuperpowers,t2_u8c6l,2020-09-28 04:05:08,1,47,You can transfer the hair stuck in your mouth to be stuck in someone else's mouth who is within whisper distance.  
33,shittysuperpowers,t2_zkfke,2020-09-28 03:21:31,1,9,You're 75% slower while holding hands  
34,shittysuperpowers,t2_ckwx4,2020-09-28 02:22:50,1,12,You can smell the future.  
35,shittysuperpowers,t2_5nl9piw9,2020-09-28 02:15:11,0,5,"You can induce temperature changes in objects based on what color they are. Objects with dark or cool colors like purple will get extremely cold on activation, while ones with lighter or warmer colors like red will heat up.

Intermediate colors like green will still be affected, but not have as drastic of changes."
36,shittysuperpowers,t2_3xn7mb7f,2020-09-28 02:07:57,2,3,"Anytime you plan to go out, all of your shoes teleport onto other people's feet.  "
37,shittysuperpowers,t2_mnv7z,2020-09-28 02:04:01,1,3,"You instantly know the ending of every book or movie that you begin. Just the ending, none of the details in the middle."
38,shittysuperpowers,t2_2fb70j90,2020-09-28 02:02:43,5,6,"You can make furniture out of human bones The furniture is of the finest quality, and can be created with a single touch."
39,shittysuperpowers,t2_6k7ehywh,2020-09-28 01:42:58,2,18,Paper airplanes thrown by you fly perfectly straight  
40,shittysuperpowers,t2_zkiwn,2020-09-28 01:36:11,4,10,All life within a 3 meter radius is instantly atomized.  
41,shittysuperpowers,t2_4jtus7ci,2020-09-28 01:01:54,0,8,"You can repair broken bones, bones are made out of glass Break a leg and the bones of the leg will be made out of glass"
42,shittysuperpowers,t2_8glvw,2020-09-28 00:36:46,0,16,"You can smell 1.5x better while wearing a fake mustache and monocle, 2x better with a top hat.  "
43,shittysuperpowers,t2_3bahfguj,2020-09-28 00:36:42,2,14,Your IQ increases with the temperature of the room you are currently in  
44,shittysuperpowers,t2_5nmmrkg1,2020-09-28 00:16:20,2,3,"Ability to start inflation I can start inflation.

&amp;#x200B;

&amp;#x200B;

&amp;#x200B;

&amp;#x200B;

&amp;#x200B;

&amp;#x200B;

&amp;#x200B;

&amp;#x200B;

&amp;#x200B;

&amp;#x200B;

&amp;#x200B;

&amp;#x200B;

&amp;#x200B;

&amp;#x200B;

The inflation has started"
45,shittysuperpowers,t2_x22v4,2020-09-27 23:50:57,3,15,You can sing like a superstar only when you pissing.  
46,shittysuperpowers,t2_4yik7cqe,2020-09-27 23:35:43,5,8,You're like an air bender... ... but you can only bend soup
47,shittysuperpowers,t2_42usrjvo,2020-09-27 23:15:56,3,3,If you drink any kind of piss you can piss purified water.  
48,shittysuperpowers,t2_3olvamtz,2020-09-27 23:13:50,5,18,"Your vomit now tastes like chocolate. No matter what you eat, it always remains chocolate flavored.  "
49,shittysuperpowers,t2_3r8db39c,2020-09-27 22:37:01,1,13,You only get swooped by minor birds  
50,shittysuperpowers,t2_45w4hamw,2020-09-27 22:12:42,1,7,You can identify planes without trying only if it’s a Boeing 747  
51,shittysuperpowers,t2_7den6hwg,2020-09-27 20:34:20,9,15,"You can make any mailman in the world that has a ""Do NOT Fold"" envelope, fold it. Also, of course, any package that says ""Do Not Stack"" will inevitably be stacked...

...and those that say ""Warning: Fragile!"", will be handled as effectively as a person afflicted with Parkinson's with their hands full of butter and a bad mood."
52,shittysuperpowers,t2_6jig7v91,2020-09-27 19:36:09,2,4,You can remember every snowflake that you tasted/ ate  
53,shittysuperpowers,t2_4t0lcvi4,2020-09-27 19:34:46,2,3,You have complete control over pure elements in liquid form at room temperature  
54,shittysuperpowers,t2_1e2sz569,2020-09-27 19:33:33,7,14,"When you look at a star, it instantly goes into a supernova  "
55,shittysuperpowers,t2_8852sd5f,2020-09-27 19:32:48,1,2,You can know a random llamas body temrature when having your thumb in your nose (that was original wasent it)  
56,shittysuperpowers,t2_82rag95g,2020-09-27 19:14:57,1,7,You now have the ability to lay your own eggs so long as you get 30 minutes of sun a day.  
57,shittysuperpowers,t2_1fafwwf7,2020-09-27 19:04:24,3,13,the ability to always insert a usb the right side up on the first try  
58,shittysuperpowers,t2_zhrvt,2020-09-27 18:41:12,2,14,"You can tell how well a date is going solely by your farts The louder and stinkier they are, the better the date is going."
59,shittysuperpowers,t2_40493ecc,2020-09-27 18:29:50,2,12,"You can see where every piece of trash you've ever thrown away has ended up or what it has become It'll be like ""i wonder what happened to my old spiderman toy"" then you can see where it is now and what happened to it"
60,shittysuperpowers,t2_2uug4cad,2020-09-27 18:01:16,6,22,"You can turn back time. Doing so also resets everything to that point in time, including your memories. Say if it was 10pm on a Monday and you wanted to turn back time to 10am that same day. Time will be turned back, but you return to your former self at 10am on Monday with only the memories from that former self. In other words, you have no idea whether you just turned back time or not"
61,shittysuperpowers,t2_4np17yii,2020-09-27 17:33:57,1,11,"Everytime you throw an object there's a 5% chance it'll chase your target, even around corners.  "
62,shittysuperpowers,t2_xec79,2020-09-27 17:19:46,4,4,Any edit you make to Wikipedia will come true  
63,shittysuperpowers,t2_57pcfshm,2020-09-27 16:58:49,1,17,"Every time you say ""Motherfucker"", you sound exactly like Samuel L. Jackson  "
64,shittysuperpowers,t2_4sncxl2r,2020-09-27 16:51:20,2,12,"You can repost as many shitty superpowers, and no one will notice or care, and your post will have many upvotes. Look like some people in this subreddit have this superpower kof kof"
65,shittysuperpowers,t2_c081v83,2020-09-27 16:33:25,4,7,Your eyebrows color changes to red for 15 minutes every time you look at something you shouldn't have  
66,shittysuperpowers,t2_5b2tvr45,2020-09-27 16:19:56,0,11,Your shit looks and smels like dog shit  
67,shittysuperpowers,t2_58cn7trq,2020-09-27 16:12:07,0,15,You can talk to plants in ancient hebrew.  
68,shittysuperpowers,t2_7esh6hki,2020-09-27 15:18:20,2,10,You can summon a tiny flame at the top of your index finger. Basically a human birthday candle.  
69,shittysuperpowers,t2_62elf8dc,2020-09-27 15:03:03,1,27,You can transform into a van when you are taking a magnum shit  
70,shittysuperpowers,t2_19rt7hc,2020-09-27 15:02:23,6,12,Everytime you see or hear an odd number you shit yourself same amount in kg  
71,shittysuperpowers,t2_6ogmlvtr,2020-09-27 14:48:41,1,5,You can turn people into stale cheez-its by touching them  
72,shittysuperpowers,t2_4z1x7si0,2020-09-27 13:52:55,0,14,You can change a cars license plate by completely destroying the car  
73,shittysuperpowers,t2_13qs9b,2020-09-27 12:49:05,7,16,Roof of your mouth is immune to burns.  
74,shittysuperpowers,t2_50bt996k,2020-09-27 12:29:35,1,29,"Whenever you fart, you will be launched upwards or to the side. You can control your direction. The stinkier the fart, the farther you can go. The louder the fart, the higher you can go, if it's both, you will fly through the ceiling at 100MPH and probably die.  "
75,shittysuperpowers,t2_50bt996k,2020-09-27 12:18:25,5,21,"If you touch a bad game, movie or book, it immediately turns into a 1cmx1cm cube of jello  "
76,shittysuperpowers,t2_7ebz1h3i,2020-09-27 11:35:53,9,139,"You can make someone cum spaghetti sauce, only if you're staring at their hands  "
77,shittysuperpowers,t2_30gbdyob,2020-09-27 11:35:08,4,34,if you recite all the words to “Mario pissing” you will piss with immense power.  
78,shittysuperpowers,t2_4np17yii,2020-09-27 11:10:50,4,8,You can turn diarrhea into soup.  
79,shittysuperpowers,t2_7jx2s2qs,2020-09-27 10:58:59,2,19,You know where the nearest minecraft hacker lives  
80,shittysuperpowers,t2_7jx2s2qs,2020-09-27 10:53:52,1,26,You can remotely tell if you won't like someone by jacking off while thinking about them.  
81,shittysuperpowers,t2_26y5ldnv,2020-09-27 08:41:18,4,17,"You can read people's minds, alas you only hear every third word  "
82,shittysuperpowers,t2_6mw0ye8s,2020-09-27 06:41:56,1,12,"You can shit eyeballs if you feel someone is watching you in public This cannot happen in an enclosed building or household. You only get the urge in public, and if you feel someone is watching you"
83,shittysuperpowers,t2_6b570ji8,2020-09-27 06:09:39,2,13,"You always have super speed whenever you run downstairs. Once you're no longer on the stairs, your speed immediately goes back to normal."
84,shittysuperpowers,t2_4e4irwtc,2020-09-27 05:43:12,2,17,You can summon an army of mosquitoes to bite that one place on your back that you can't quite reach.  
85,shittysuperpowers,t2_6e3n58ho,2020-09-27 05:33:51,0,5,"Everytime you hesitate you convince yourself that you made the right decision. Months/years after the choice has taken effect you still are good at persuading yourself into thinking you made the right choice and you attain an unwavering belief in your faulty self. (I clearly have no past experience or trauma caused by bad decision making)~sarcasm, I do that's why it's my special ability!"
86,shittysuperpowers,t2_6hz93v0w,2020-09-27 04:35:26,1,14,"You can start a zombie like sencario by dressing up like a pirate and by singing ""You are a Pirate"". This will effect everyone who hears you and once infected, they will magically don pirate garb and start singing with you."
87,shittysuperpowers,t2_ii6lk,2020-09-27 04:11:22,1,15,You can kick with your hands and punch with your feet self explanatory
88,shittysuperpowers,t2_ii6lk,2020-09-27 04:10:51,8,25,"You can tell exactly whats wrong with anything you nut on yes this works with people too. Yes you’ll know how to fix it too but you have to do it each time, you cant fix it for one thing and know how to do it again for another, you have to individually nut on whatever it is you want to fix."
89,shittysuperpowers,t2_ii6lk,2020-09-27 04:07:36,1,18,"You can always say exactly what a person needs to hear to feel better except you can never know what it means you could say something random like “yes, the lettuce does go on mangoes at midnight” and they’ll be like oh my god how did you know or jeez i really needed to hear that i appreciate you and stuff and people can finally love you again"
90,shittysuperpowers,t2_4wa27vig,2020-09-27 04:00:19,2,5,You can see sounds  
91,shittysuperpowers,t2_1x6qhgqa,2020-09-27 03:47:09,0,2,You can summon a fedora anytime anywhere only if you have a neckbeard  
92,shittysuperpowers,t2_4t0lcvi4,2020-09-27 03:14:47,1,11,You walk .4% faster when driving your car and an hour afterwards  
93,shittysuperpowers,t2_48iekxnq,2020-09-27 01:39:53,9,145,"You can cough up your own spine and then slurp it back down like a spaghetto Whilst out, you can both use it as a secondary super tongue, and be a wet, slippery noodle"
94,shittysuperpowers,t2_4np17yii,2020-09-27 01:02:48,3,14,Your shit smells like chocolate.  
95,shittysuperpowers,t2_27pvanah,2020-09-27 00:48:13,20,47,You can walk as fast as the speed limit of the nearest road  
96,shittysuperpowers,t2_84vlz3q2,2020-09-27 00:45:20,2,4,You can grow a Rutherford Hayes beard if you recite the alphabet backwards while staring directly into a flashlight  
97,shittysuperpowers,t2_4sotzx5j,2020-09-27 00:20:53,2,4,You can turn your dick cheese into C4  
98,shittysuperpowers,t2_6e3n58ho,2020-09-26 23:02:00,2,17,"Everytime you fantasize about having sex with a particular person and you masturbate, when you climax that person gets rick rolled at the exact same time.  "
99,shittysuperpowers,t2_6e3n58ho,2020-09-26 22:50:35,2,5,"You can convince everyone you meet to have a long lived, fulfilling relationship with you, except that first you need to rape them once a month for an entire year.  "
100,shittysuperpowers,t2_6mkiiim7,2020-09-26 22:34:13,1,11,You can tell lavas temperature by touching it.  
101,shittysuperpowers,t2_6mkiiim7,2020-09-26 22:33:40,2,10,You can flawlessly cut 100$ bills in half.  
102,shittysuperpowers,t2_1e2sz569,2020-09-26 21:56:04,1,9,"When you look at a star, its name pops up next to it  "
103,shittysuperpowers,t2_mnv7z,2020-09-26 21:43:54,1,12,"You can sense when you've passed within 10ft of someone with covid, 5 minutes after it happened  "
104,shittysuperpowers,t2_gz3gdvk,2020-09-26 20:55:56,3,6,You gain the ability to perfectly control your breathing at will while losing the ability to breath automatically  
105,shittysuperpowers,t2_sp9g0,2020-09-26 20:50:12,0,1,You have the power of using your fists and legs to punch and kick one person at a time to make them mad/violent at you.  
106,shittysuperpowers,t2_2tbay1tm,2020-09-26 20:37:41,2,5,"Whenever you get embarrassed, you shit your pants. If you get embarrassed by shitting your pants, you shit your pants again.  "
107,shittysuperpowers,t2_dcx0sbx,2020-09-26 20:35:06,0,12,You can make lego inject an extremely deadly poison when stepped on  
108,shittysuperpowers,t2_ii6lk,2020-09-26 20:13:22,8,4,You are now blind and are unable to see you are blind and can not see because you are blind
109,shittysuperpowers,t2_f6sn48g,2020-09-26 19:37:20,3,7,You can pee tabasco sauce  
110,shittysuperpowers,t2_82rag95g,2020-09-26 18:23:33,6,34,You now have the ability to rationalize with a three year old.  
111,shittysuperpowers,t2_qn1je,2020-09-26 17:23:32,5,10,You can see a colorful smoke Trail behind people who have farted within 3 minutes. Color of the Trail is based on their personality. Survival tip: you don't wanna walk behind one with red trail.
112,shittysuperpowers,t2_5gdjw6,2020-09-26 17:20:29,8,16,You can taste every word you read.... every word Even the word ‘word’
113,shittysuperpowers,t2_4sotzx5j,2020-09-26 17:10:57,3,26,You receive post nut clarity so hard that you can predict the future an hour in advance  
114,shittysuperpowers,t2_83jr3okj,2020-09-26 16:34:30,9,25,You can make poop go back up people's butthole  
115,shittysuperpowers,t2_2t0iwvsd,2020-09-26 15:50:20,3,18,You have the power to sunbathe your eyes  
116,shittysuperpowers,t2_6d1atqg7,2020-09-26 14:39:42,12,39,"You can beat anyone at rock, paper, scissors if they are under 6 feet tall  "
117,shittysuperpowers,t2_70h3tdhr,2020-09-26 14:28:53,5,69,Subtitles for your native language appear above peoples’ heads allowing you to understand languages you don’t know But there is a 10 second lag between what they’re saying and the subtitles
118,shittysuperpowers,t2_80si7ixs,2020-09-26 14:13:16,5,12,you have the ability to control balloons  
119,shittysuperpowers,t2_f6sn48g,2020-09-26 14:11:49,245,7585,"Whenever someone tells you to ""go fuck yourself' you can create a temporary clone to have sex with The clone is an exact copy of you in every way"
120,shittysuperpowers,t2_f6sn48g,2020-09-26 13:49:20,14,54,You are immune to lead poisoning from bullets  
121,shittysuperpowers,t2_15e8aj,2020-09-26 13:43:14,3,21,"Whenever you throw dice or flip a coin, they will always land on their edges.  "
122,shittysuperpowers,t2_8852sd5f,2020-09-26 13:16:32,9,5,"You can breath underwater, b.u.t water will kill you if touched  "
123,shittysuperpowers,t2_4hri95p,2020-09-26 13:09:39,2,8,You can slide on any surface like it’s socks on hardwood  
124,shittysuperpowers,t2_15e8aj,2020-09-26 12:53:46,1,20,What you hit when you throw a jab receives a mild electric shock.  
125,shittysuperpowers,t2_15e8aj,2020-09-26 12:53:41,7,104,You can fire a bubble from your mouth that increases in size for every second you hold your breath.  
126,shittysuperpowers,t2_5b7zhpwu,2020-09-26 11:52:07,14,94,you can piss with the force of a fire hose.  
127,shittysuperpowers,t2_5dqfxpq9,2020-09-26 10:49:42,3,11,You can rise from the dead and have the potential to be one of the greatest kings of all time. Yet you have to live north of the wall..  
128,shittysuperpowers,t2_72xozgns,2020-09-26 08:43:44,3,10,"Everything you eat taste like choco-mint. Disclaimer: Only the taste change, not the properties of the substances. For example, if you were happen to eat some poison, it will taste like choco-mint but still poisonous."
129,shittysuperpowers,t2_3gkis9rk,2020-09-26 08:30:50,0,31,"When you’re happy and you know it, you make other people clap their hands  "
130,shittysuperpowers,t2_2ukto9ew,2020-09-26 06:49:34,15,20,you have wings that are controlled by your boner  
131,shittysuperpowers,t2_5bgijhsu,2020-09-26 06:28:53,5,9,You can change your ethnicity by the types of foods you eat  
132,shittysuperpowers,t2_3eocvwed,2020-09-26 06:13:38,2,8,You know the name of anyone you touch  
133,shittysuperpowers,t2_82rag95g,2020-09-26 06:03:46,31,618,You now have the ability to make babies cry or shit on command.  
134,shittysuperpowers,t2_763xgqzb,2020-09-26 05:50:25,2,9,You can read peoples minds when they think negatively of you you can read peoples minds but only when they think negatively of you
135,shittysuperpowers,t2_4iql0c7n,2020-09-26 05:46:18,1,11,You can out-obvious Captain Obvious. Obviously.  
136,shittysuperpowers,t2_2xmjwa43,2020-09-26 05:42:23,3,1,"You can instantly grow any plant, and as soon as it comes into contact with semen, it explodes and leaves behind a turtle, which will die after 4 seconds  "
137,shittysuperpowers,t2_4y3hjrl7,2020-09-26 05:25:20,3,29,You can turn yourself inside out  
138,shittysuperpowers,t2_79w7ax75,2020-09-26 05:25:08,4,9,You can think of all the puns you could make in a conversation  
139,shittysuperpowers,t2_3k3q2yr3,2020-09-26 05:20:52,10,99,You can make someone pee for you when you feel like peeing.  
140,shittysuperpowers,t2_3qcfj77n,2020-09-26 05:17:40,10,25,you are now Florida man  
141,shittysuperpowers,t2_zue8n,2020-09-26 04:40:38,16,242,"Any water gun you shoot fires actual bullets, while any real gun shoots water. Imagine shooting a missle in one of those big super soakers"
142,shittysuperpowers,t2_4lii3khy,2020-09-26 03:52:57,0,12,Any sentence you post in r/Shower thoughts will instantly become so complicated that people can only assume it's something vaguely like an actual shower thought *r/showerthoughts
143,shittysuperpowers,t2_26zsxt2l,2020-09-26 03:00:46,0,4,You can find anything that you can see.  
144,shittysuperpowers,t2_4y3hjrl7,2020-09-26 02:49:20,3,13,You can permanently disguise as someone by sneezing on them  
145,shittysuperpowers,t2_6e3n58ho,2020-09-26 02:36:52,0,16,"Your farts smell like perfume, except that you need to be naked while farting.  "
146,shittysuperpowers,t2_6e3n58ho,2020-09-26 02:33:18,4,14,You age five years each time you talk in Old English  
147,shittysuperpowers,t2_6e3n58ho,2020-09-26 02:23:01,14,28,"When you wake up from a dream, you wake up in the exact same location as the one in the setting of your dream.  "
148,shittysuperpowers,t2_3l9sfra1,2020-09-26 02:20:28,3,12,you can tie shoes really fast  
149,shittysuperpowers,t2_3l9sfra1,2020-09-26 02:19:33,2,12,your spit can be used as a weak detergent  
150,shittysuperpowers,t2_4zzmzvm1,2020-09-26 02:16:24,5,23,You can add a second to your lifespan by wearing a robe for a year.  
151,shittysuperpowers,t2_4o12tquk,2020-09-26 02:05:26,2,15,You can switch places of your legs.  
152,shittysuperpowers,t2_8852sd5f,2020-09-26 01:52:16,1,9,You have the power to feel the pain that the ground feel When u step in it  
153,shittysuperpowers,t2_2sau90p5,2020-09-26 01:51:36,8,17,You can time travel. To do so you must shit your pants and you can only travel to a point in the past that you also shit your pants. Do you start creating “save points”?
154,shittysuperpowers,t2_79w7ax75,2020-09-26 01:16:32,9,22,Everytime you break a bone you get a five dollar discount on every store you go  
