,subreddit,author,created_date,number_of_comments,upvotes,post
155,shittysuperpowers,t2_80xc4aw4,2020-09-26 00:57:09,6,53,You can tell if a person is romantically interested in you but only after you shit your pants in front of them  
156,shittysuperpowers,t2_wc9lfz,2020-09-26 00:56:42,2,16,Your vision is constantly zoomed in Imagine playing a game with the lowest field of view. Yea that’s your reality now
157,shittysuperpowers,t2_3q0iw7eg,2020-09-26 00:35:43,1,11,You can teleport anyone anywhere with a rotten dish of their favorite food  
158,shittysuperpowers,t2_8852sd5f,2020-09-26 00:22:54,2,15,"You can now talk to plants, keep in mind the plants won’t talk back  "
159,shittysuperpowers,t2_25bz17jt,2020-09-26 00:08:33,1,12,You can prevent rain from happening when going out carrying an umbrella  
160,shittysuperpowers,t2_3q0iw7eg,2020-09-25 23:59:16,1,13,To make your belly button actually talk  
161,shittysuperpowers,t2_1rl7nzfl,2020-09-25 23:36:58,1,4,Everytime you close your eyes you cant see.  
162,shittysuperpowers,t2_4uv1638b,2020-09-25 23:35:27,3,13,"You can summon a thick sphere of seran wrap around a racist's head at will. You don't need to know the racist, you can randomize the target. You could also choose to only do it for racists who killed or harm someone out of hate."
163,shittysuperpowers,t2_15db8v,2020-09-25 23:24:41,2,8,Spiderwebs will glow so you can see them 7 inches away from you  
164,shittysuperpowers,t2_708vr1e1,2020-09-25 22:59:34,4,7,"You can point at someone and make their skin any color you want, or make it see-through so their insides are showing.  "
165,shittysuperpowers,t2_1ev2bgw2,2020-09-25 22:56:34,6,11,You can turn off friction for yourself at will Friction is no longer something that applies to you. This is also reversible and can be used whenever you want.
166,shittysuperpowers,t2_8852sd5f,2020-09-25 22:50:50,12,82,You can predict the end of a movie though it takes as long as the movie itself to to that  
167,shittysuperpowers,t2_5fzzie8b,2020-09-25 22:31:08,5,10,You can be invisible only when you masturbate  
168,shittysuperpowers,t2_7den6hwg,2020-09-25 22:26:22,3,11,You can know who the imposter/s is/are in Among Us. Once you're dead.
169,shittysuperpowers,t2_5bojxeav,2020-09-25 22:06:30,3,10,"If more than 50 percent of your fart enters a persons lungs, they fall in love with you on the spot.  "
170,shittysuperpowers,t2_2l6gtw69,2020-09-25 21:46:15,4,8,"You can piss ants which will proceed to march to the nearest chicken and swarm it For clarity, it flows like piss."
171,shittysuperpowers,t2_61xgubjm,2020-09-25 21:43:24,2,7,"Every time you blink, a random person in your country poops  "
172,shittysuperpowers,t2_ii6lk,2020-09-25 21:38:13,0,7,You can speak every language and don’t understand what you or others are thinking/saying You can choose any language to start speaking in but you stop being able to understand any verbal thought you have and can’t understand what others say in that language
173,shittysuperpowers,t2_3n8r1yfc,2020-09-25 21:34:11,9,19,Your urine turns things gold  
174,shittysuperpowers,t2_4awlgmmd,2020-09-25 21:33:14,4,8,Having the ability to smell an erection within 27 yards  
175,shittysuperpowers,t2_3n8r1yfc,2020-09-25 21:30:58,2,11,You now can talk to plants They only say plant
176,shittysuperpowers,t2_3n8r1yfc,2020-09-25 21:28:57,3,20,You now can swap heads with a fly The head doesn't change size
177,shittysuperpowers,t2_3n8r1yfc,2020-09-25 21:25:47,1,14,You can make others hear food screem when you consume it  
178,shittysuperpowers,t2_616js4og,2020-09-25 21:07:44,3,8,You can make any towel of your choice wet with the snap of your fingers. How would you use this power to fuck with your enemies.
179,shittysuperpowers,t2_ii6lk,2020-09-25 21:03:08,10,16,"You can telepathically Rick Roll No radius. You can telepathically Rick Roll any existing person who is alive. 

And yes if they don’t know the song for some reason they’ll still get Rick Rolled but they’ll just be very confused"
180,shittysuperpowers,t2_3iegvga0,2020-09-25 20:44:17,2,6,"All your pets have 9 lives You won't know until they die*

*Must kill pet in order to find out"
181,shittysuperpowers,t2_1cvu17l3,2020-09-25 20:43:41,11,23,You are what you eat.  
182,shittysuperpowers,t2_7a0cptwk,2020-09-25 20:39:41,0,6,You always get a 1% discount on all the rugs you buy  
183,shittysuperpowers,t2_8glvw,2020-09-25 20:38:49,2,7,Your butthole works like a Chinese finger trap.  
184,shittysuperpowers,t2_162yys,2020-09-25 20:24:14,2,9,You body will turn to dried leaves when you die.  
185,shittysuperpowers,t2_162yys,2020-09-25 20:14:07,8,48,You can make people forget that you have this superpower.  
186,shittysuperpowers,t2_3ttzfkeo,2020-09-25 19:59:15,9,63,"For every full bottle of dried oregano you eat, you can shoot fully cooked spaghetti out of your fingertips for up to an hour  "
187,shittysuperpowers,t2_35d36dcp,2020-09-25 19:36:43,4,12,"You can speak any language.. butt every sentence you speak has to end with that language’s translation of “no homo.” Creo que comida mexicana es la mejor en todo el mundo, no homo."
188,shittysuperpowers,t2_35lctq0w,2020-09-25 18:54:25,0,7,Stepping into sunlight sets a random thing on fire  
189,shittysuperpowers,t2_rmuqi,2020-09-25 18:50:36,0,8,You can instantly infer context from any quote or reference made within your hearing.  
190,shittysuperpowers,t2_88bziqfa,2020-09-25 18:50:01,1,4,You can eat 100 year old eggs without getting sick and you actually like them  
191,shittysuperpowers,t2_3emnvyz9,2020-09-25 18:40:06,0,2,You can tell if someone is lying if they tell you so  
192,shittysuperpowers,t2_607royra,2020-09-25 18:36:13,11,15,"Every time u click ur mouse button, you earn 0.001$. This is prob not useless, but let’s see"
193,shittysuperpowers,t2_88bziqfa,2020-09-25 18:35:04,12,31,You can vomit on command  
194,shittysuperpowers,t2_2hw0qe59,2020-09-25 18:17:22,8,12,You can become invisible when you have more than 100 living spiders on your skin  
195,shittysuperpowers,t2_cu7h9,2020-09-25 18:00:35,1,9,"When eating food that you dip into a condiment, you always finish both with no leftover. For example, if you were to eat French Fries with ketchup, you'd be able to perfectly portion out eat dip so that you'd never have extra ketchup afterwards nor will you have finished the ketchup early and have to eat the rest of the fries dry or pour more ketchup.

This works with any other food (ie: tortilla chips and salsa). This only applies to you eating the food, not when preparing the dish and not when judging any ratios outside of the food that you are eating at the time."
196,shittysuperpowers,t2_7jx2s2qs,2020-09-25 17:52:07,4,6,You can stop sand from getting between your toes if you complain about it  
197,shittysuperpowers,t2_67pwelkc,2020-09-25 17:52:06,0,7,Playing the flute like a snake charmer will make any ants in the surrounding area slightly dizzy.  
198,shittysuperpowers,t2_67pwelkc,2020-09-25 17:42:39,3,28,Any cavemen near you will automatically die.  
199,shittysuperpowers,t2_8852sd5f,2020-09-25 17:19:42,0,8,"You’ll be super smart at math though you’ll be incompatible to read, talk and write when u use the ability  "
200,shittysuperpowers,t2_3rocmcxe,2020-09-25 17:12:11,2,5,You can lift one pound more than the weakest person in the room. If no one else is in the room your strength goes back to normal.
201,shittysuperpowers,t2_8852sd5f,2020-09-25 17:02:23,6,17,You have the power to read your own mind!  
202,shittysuperpowers,t2_fm6to,2020-09-25 16:51:15,0,8,You can walk through closed doors only if they’re also unlocked  
203,shittysuperpowers,t2_5h4dt0u8,2020-09-25 16:23:06,9,17,You can have sex with whoever you want and whenever you want But you're always the bottom
204,shittysuperpowers,t2_1z4bitkm,2020-09-25 16:15:10,2,4,You become bulletproof after you get shot  
205,shittysuperpowers,t2_4zzmzvm1,2020-09-25 16:05:13,3,5,You can make your feet shrink.  
206,shittysuperpowers,t2_4zzmzvm1,2020-09-25 15:59:13,3,12,You can hit your head on a wall 4 times before it starts hurting.  
207,shittysuperpowers,t2_51ramwgl,2020-09-25 15:51:02,1,28,"You always know why a helicopter is flying overhead Anytime a helicopter flys by or is circling a specific area everyone watches it for a moment and someone inevitably says “I wonder what happened?”, well today is that guys lucky day because you know exactly why that heli is there and what happened."
208,shittysuperpowers,t2_33okd33b,2020-09-25 15:50:00,3,9,You can delete other peoples comments.  
209,shittysuperpowers,t2_x3vx4,2020-09-25 15:44:00,0,7,"You see, hear, etc. 2 seconds in the future. You can't see the ""now"" while this ability is active. It has a 24 hours cooldown on switching modes, but no limit on duration."
210,shittysuperpowers,t2_4yiaw9nl,2020-09-25 15:20:13,9,32,You can make people use the metric system  
211,shittysuperpowers,t2_5b8oxdg6,2020-09-25 15:05:31,5,10,"Whenever you're horny, you can summon any character, fictional or not, and it will always have an appearance that'll turn you off.  "
212,shittysuperpowers,t2_5b8oxdg6,2020-09-25 15:02:03,1,6,You can make people believe you're a meth-addicted street beggar anytime you want.  
213,shittysuperpowers,t2_2hrgp8mz,2020-09-25 15:01:51,8,20,"By kissing someone on the lips, you can pop a dollar out of your ass  "
214,shittysuperpowers,t2_57pcfshm,2020-09-25 14:28:57,333,10578,"You can pee other people's pants 1 mile radius, you select person and yeah no further explanation needed"
215,shittysuperpowers,t2_6bxnz7c5,2020-09-25 14:15:05,10,6,You can teleport your toenail clippings ...But not inside other people. That would be OP.
216,shittysuperpowers,t2_53j56uw2,2020-09-25 14:14:45,2,3,There is a 50% chance you get an erection if the teacher asks you to stand up  
217,shittysuperpowers,t2_8tx4c8s,2020-09-25 13:55:35,3,7,You can see throught mask  
218,shittysuperpowers,t2_8852sd5f,2020-09-25 13:42:11,5,6,You are an earthbender though everyone else is a avatar  
219,shittysuperpowers,t2_7jx2s2qs,2020-09-25 13:02:39,12,37,You can turn dead frogs to stone Yes lads
220,shittysuperpowers,t2_6ju5jm6j,2020-09-25 12:45:46,1,3,"You can teleport, but only to the location of the nearest Juggalo  "
221,shittysuperpowers,t2_6bpdpg0p,2020-09-25 11:38:27,4,47,Your foreskin comes all the way back &amp; you can take your entire skin off.  
222,shittysuperpowers,t2_2qwa7o0s,2020-09-25 11:02:12,4,5,"Every time you think in of a number, someone randomly around the world will have his finger grown that size Btw you can think what measure you want it to be (inches, cm, etc)"
223,shittysuperpowers,t2_1et8ga84,2020-09-25 10:40:06,3,38,You can lure the closest ambulance when you shit your pants.  
224,shittysuperpowers,t2_4yrfp8mf,2020-09-25 10:26:51,16,75,"You can turn into a bush That’s it that’s the power

Edit: a plant bush not a person bush."
225,shittysuperpowers,t2_xcy6u,2020-09-25 10:12:03,9,89,You know every answer to every test when you moan really loud  
226,shittysuperpowers,t2_5rowj414,2020-09-25 09:48:58,4,8,Can't do title BC not creative Every time you cum you grow a new dick
227,shittysuperpowers,t2_9m7z7,2020-09-25 09:44:35,1,5,"You have a paralyzing fear of water, and every time you think about swimming and feel that fear everyone within 5 miles screams and slaps themselves.  "
228,shittysuperpowers,t2_74nxw4ne,2020-09-25 09:13:59,3,31,You can summon the band Smash Mouth to any viable location for a pop-up concert!  
229,shittysuperpowers,t2_9m7z7,2020-09-25 09:06:44,5,6,"As long as you're completely naked and not touching any part of yourself, you're invulnerable.  "
230,shittysuperpowers,t2_49w2ft0f,2020-09-25 08:55:46,1,3,You can teleport short distance only when people eyes are closed  
231,shittysuperpowers,t2_8glvw,2020-09-25 08:07:15,2,7,You can take your nose off to pick it.  
232,shittysuperpowers,t2_1rehfz3m,2020-09-25 07:40:40,2,16,You can throw your eyelashes like boomerangs  
233,shittysuperpowers,t2_6cs2zwnh,2020-09-25 07:33:01,5,19,"You can go 60 seconds into the past, by swinging all the way round on a swing set.  "
234,shittysuperpowers,t2_7e8obje9,2020-09-25 07:11:15,6,15,You can walk through walls and your cloths cannot.  
235,shittysuperpowers,t2_7e8obje9,2020-09-25 07:09:55,5,7,"People will never reply to your texts with a ""hmmm"".  "
236,shittysuperpowers,t2_7e8obje9,2020-09-25 07:08:48,3,21,You run 10% faster while you're masturbating.  
237,shittysuperpowers,t2_7e8obje9,2020-09-25 07:06:41,2,10,The sound of your sneeze is replaced by a loud and long moan.  
238,shittysuperpowers,t2_1bgmt90y,2020-09-25 07:05:07,6,12,You can command dragons. Too bad there are no dragons in your lifetime.  
239,shittysuperpowers,t2_7e8obje9,2020-09-25 07:04:49,8,26,You can puke blood at your will.  
240,shittysuperpowers,t2_4oy57e7n,2020-09-25 07:01:21,0,7,You have x-ray vision But it’s randomly turned on and off any you lose depth perception when it’s on
241,shittysuperpowers,t2_lb9hs,2020-09-25 06:56:18,4,3,"All your limbs have foreskin Arms, legs, fingers, toes and head. Maybe for the nose as well, if you are feeling adventurous."
242,shittysuperpowers,t2_56vv2udf,2020-09-25 06:38:13,0,5,You know what Time is it in random Country Just by taking a shit  
243,shittysuperpowers,t2_4g3e3486,2020-09-25 06:38:07,1,6,"Whenever you dab, a random person farts.  "
244,shittysuperpowers,t2_55owhc56,2020-09-25 06:38:04,1,2,"Your mutant evolution has given you the proper anatomy to posses a functional cloaca. A cloaca is a multipurpose orifice used for multiple orifice related needs such as, eating, breathing, pooping, mating and self defense."
245,shittysuperpowers,t2_xous3bl,2020-09-25 06:33:11,2,9,You are just as invisible as you feel you are.  
246,shittysuperpowers,t2_1ndtp4sb,2020-09-25 06:01:29,0,3,You can give yourself temporarily deafening tinnitus to tune out other loud or annoying noises  
247,shittysuperpowers,t2_5htsnbu8,2020-09-25 05:24:36,4,29,"You can see in the dark, only if you close your eyes  "
248,shittysuperpowers,t2_6c10ybzj,2020-09-25 04:41:33,0,1,"Everytime you kiss a certain person, you swear you can fly  "
249,shittysuperpowers,t2_4iql0c7n,2020-09-25 03:56:33,4,13,"You can gain or lose weight by willing non-lethal constipation or diarrhea upon yourself for as long as necessary to get the job done. Seems like, pretty soon, you'd learn to be happy with whatever weight you're at...

EDIT: Because constipation and diarrhea are WAY WORSE than being too fat or too thin. Either is just a terrible option lol..."
250,shittysuperpowers,t2_2xayao2m,2020-09-25 03:54:01,4,3,"You can desychronize all clocks in a 1 kilometer radius at will. You have the power to desynchronize all clocks in a 1 kilometer radius centered on you at will.

all clocks in the area of effect are set either forward or behind by 1-360 seconds, decided at random.

(example: one clock is set forward 36 seconds, and another is set behind by 193 seconds.)"
251,shittysuperpowers,t2_6c0flvjo,2020-09-25 03:41:43,4,9,"You can never lose your nerf darts, ever it's nerf or nothing"
252,shittysuperpowers,t2_3iegvga0,2020-09-25 03:09:45,7,3,"Magical van of stuff and things You own a van that, whatever you spray paint on the side, is inside the van. You must get people into the van, otherwise no stuff.

Van looks shady af, think rape van x10"
253,shittysuperpowers,t2_66j5fm3n,2020-09-25 03:06:14,14,6,You can only eat what your reddit username is.  
254,shittysuperpowers,t2_5dqrwf9x,2020-09-25 02:50:56,4,6,If a type of porn dose not exist you can make it exist by doing that type of new porn with a person.  
255,shittysuperpowers,t2_4mzcgkky,2020-09-25 02:47:07,4,10,Anything you touch becomes the last thing you touched.  
256,shittysuperpowers,t2_5f2jw4ru,2020-09-25 02:42:01,10,17,Time only moves when looking at a clock.  
257,shittysuperpowers,t2_15fdr1,2020-09-25 02:41:58,0,3,"You can freely move any object 2 solar masses or larger at speeds up to .99c, so long as you are within 10au of said object.  "
258,shittysuperpowers,t2_54d0emdx,2020-09-25 02:34:57,1,8,"Every time your heart beats someone random in the world becomes 1% shorter, this can incude you.  "
259,shittysuperpowers,t2_7o4w8uk1,2020-09-25 02:17:58,8,24,Each time you punch someone #YOU MOAN
260,shittysuperpowers,t2_1zuhzwo6,2020-09-25 01:58:44,0,10,Your hair is spaghetti That’s it. You may eat it. It may or may not grow back.
261,shittysuperpowers,t2_42xo4kt2,2020-09-25 00:45:14,5,26,In a similar fashion to Avatar The Last Airbender you too are now a bender... of pubes  
262,shittysuperpowers,t2_2wh4bj0t,2020-09-25 00:14:32,1,8,"You can slow down time 90% for you at will, so you move and think ten times as fast You can't turn it off, though, so your lifespan relative to everyone else is a tenth of normal, you can't hold a conversation without intentionally talking  r e a l l y   s l o w l y,  and everyone else is really slow and you can't learn to talk because you would just toddle away at hyperspeed and stop listening to the adults slowly groaning something."
263,shittysuperpowers,t2_4zgmhcx2,2020-09-24 23:52:22,10,39,"For every giant glass of milk you drink, your bones are indestructible for 1 hour. For every galloon of milk you can grow 1 bone wherever you want. Edit:
For every gallon of milk you drink* 

Smh I type too fast."
264,shittysuperpowers,t2_4np17yii,2020-09-24 23:47:23,7,135,You can make yourself 10% more likely to be struck by lightning.  
265,shittysuperpowers,t2_j5rh1,2020-09-24 23:42:38,4,53,You can instantly change all of the m&amp;ms in any bag of trail mix to skittles.  
266,shittysuperpowers,t2_4eyxg9cq,2020-09-24 23:31:39,6,13,You can piss 3 different streams out your dickhole at the same time  
267,shittysuperpowers,t2_4w5eafjb,2020-09-24 23:28:20,1,7,Your power is you're invisable only at the skin layer  
268,shittysuperpowers,t2_3ers2yln,2020-09-24 22:57:07,18,545,"Every time someone tries to read your mind, your thoughts instantly switch to oppa gangnam style  "
269,shittysuperpowers,t2_7apjmmj1,2020-09-24 22:52:03,113,4364,You can lift your balls with YOUR MIND! NSFW
270,shittysuperpowers,t2_31okxnkl,2020-09-24 22:25:58,1,5,Every single ass hair you have can move and has its own will.  
271,shittysuperpowers,t2_7sns0x81,2020-09-24 21:37:10,4,10,You can lick your elbow  
272,shittysuperpowers,t2_493gnz8,2020-09-24 18:52:41,8,11,You can make disappear the last word of any  
273,shittysuperpowers,t2_57pcfshm,2020-09-24 18:16:03,3,33,You can summon crayons by pulling them out of other people's pockets  
274,shittysuperpowers,t2_7bxmofua,2020-09-24 18:15:49,1,11,"You have an amazing voice. Any person who hears your voice for the first time stops whatever he/she was doing and appreciates it for 10 whole minutes. Also applies to people who haven't heard you in a while (more than 61 days)

Enjoy the 10 whole minutes of compliments while trying to call an ambulance

Must stay shut at funerals

Don't dare utter a word in a crowded place if you value your eardrums

At least you can rob a bank or get away with murder..."
275,shittysuperpowers,t2_fqsmb,2020-09-24 18:00:22,81,4004,You can roll up the skin on your arms like sleeves  
276,shittysuperpowers,t2_4mx2hoyz,2020-09-24 17:16:45,0,15,You can eat plain nacho cheese Doritos vertically in one bite.  
277,shittysuperpowers,t2_7e8obje9,2020-09-24 17:09:49,7,16,Everytime you come across a good and funny meme you are granted a dolar and you have to pay 50 cents for every meme you see  
278,shittysuperpowers,t2_7e8obje9,2020-09-24 17:08:00,4,82,You can explain to people why Epstein didn't kill himself.  
279,shittysuperpowers,t2_7e8obje9,2020-09-24 17:07:31,8,35,You are granted the power of invisibility and you need to do a triple backflip to activate it  
280,shittysuperpowers,t2_7e8obje9,2020-09-24 17:03:07,5,25,"Everytime you pee in bed, someone else's bed gets wet.  "
281,shittysuperpowers,t2_4pxisawx,2020-09-24 16:59:16,2,40,every time you fart on Tuesday at 4:30 pm someone you hate gets a bowl of cold pasta  
282,shittysuperpowers,t2_7e8obje9,2020-09-24 16:59:16,3,12,Everytime you smell something familiar thr urge to take a shit increases by 20%  
283,shittysuperpowers,t2_31c1uvcw,2020-09-24 16:57:31,3,9,"You Can Run At The Speed Of Light for 0.1 Seconds, And You Can Only Do It Once  "
284,shittysuperpowers,t2_7e8obje9,2020-09-24 16:48:08,0,16,You have super-hightened sense of smell with a bad memory of what the smell is of  
285,shittysuperpowers,t2_3s1jmx2t,2020-09-24 15:56:34,3,10,When you have your pants on your dick is massive except when you take them off it instantly becomes tiny  
286,shittysuperpowers,t2_4sotzx5j,2020-09-24 15:35:35,19,15,"You are able to make 1 wish every time you kill someone. You cannot wish them back to life, and you cannot wish for more wishes.  "
287,shittysuperpowers,t2_11uhjz,2020-09-24 15:31:28,3,85,"When you masturbate in a room with closed doors, anyone who wants to open any door must solve a reCAPTCHA. Effect voided when you orgasm.  "
288,shittysuperpowers,t2_6aekpb3p,2020-09-24 15:22:25,5,17,"You can only laugh at the worse possible times, and your laugh is a really bad cliche evil laugh.  "
289,shittysuperpowers,t2_7fxiuun5,2020-09-24 14:54:06,5,25,You can walk on water only when you are walking backwards  
290,shittysuperpowers,t2_43yazp5c,2020-09-24 14:38:39,0,22,You can look at yourself in the mirror while wiping your butt without feeling ashamed about yourself.  
291,shittysuperpowers,t2_4oju2dc0,2020-09-24 14:15:23,6,7,You have the power to forget your cake day  
292,shittysuperpowers,t2_57pcfshm,2020-09-24 13:25:29,3,14,Your tears taste sweet instead of salty  
293,shittysuperpowers,t2_6c0flvjo,2020-09-24 13:23:49,6,13,"You can cure yourself from all diseases by eating a full bar of soap You can’t drink liquid soap though, and the full bar of soap has to be unused"
294,shittysuperpowers,t2_3yf8nwyb,2020-09-24 13:18:22,1,10,You can squeeze out hairs like popping pimples  
295,shittysuperpowers,t2_57pcfshm,2020-09-24 12:45:16,4,46,"Anytime anything you place perfectly into something makes a moaning sound Example: Puzzle pieces, a book right back into a shelf, CDs"
296,shittysuperpowers,t2_1v4n76z1,2020-09-24 12:13:28,4,62,You can sprint full speed while carrying a hot drink and not spill a drop.  
297,shittysuperpowers,t2_482vd5qw,2020-09-24 11:50:16,6,18,You can pay for microtransactions with Cash by inserting it some how into your gaming console or pc Or phone if youre that kind of person
298,shittysuperpowers,t2_3ocjlg10,2020-09-24 11:41:07,0,15,"Whenever you touch someone, you will be able to decide whether or not the soap will be foamy when the next time they take a shower.  "
299,shittysuperpowers,t2_naz27xy,2020-09-24 11:34:38,0,5,"You have the ability to switch context immediately with the person you are conversing with, avoiding to reiterate the backstory.  "
300,shittysuperpowers,t2_15e8aj,2020-09-24 10:40:48,3,16,"You can read the first chapter of a book by looking at its cover, online or otherwise.  "
301,shittysuperpowers,t2_27sfabkc,2020-09-24 10:33:51,7,22,You can choose what colour your eyes are  
302,shittysuperpowers,t2_50npj9qe,2020-09-24 10:30:19,3,8,Red Bull with extra steps You can fly but your wings are your butt cheeks
303,shittysuperpowers,t2_5gquc0wu,2020-09-24 10:24:18,1,22,Everytime you sneeze your eyelashes change with the ones of a random person  
304,shittysuperpowers,t2_5z0scvmg,2020-09-24 09:55:14,10,44,"When you hug someone, they get a cool superpower.  "
305,shittysuperpowers,t2_15e8aj,2020-09-24 08:07:22,8,19,You can shift the location of your wounds.  
306,shittysuperpowers,t2_15e8aj,2020-09-24 08:07:19,2,10,You cannot be accidentally hurt.  
307,shittysuperpowers,t2_15e8aj,2020-09-24 08:07:17,10,32,"When you hold your breath, you become weightless.  "
308,shittysuperpowers,t2_5ftzv3ry,2020-09-24 08:01:19,5,11,you can give people explosive diarrhea by winking at them witch both eyes at the same time  
309,shittysuperpowers,t2_6btxg,2020-09-24 07:20:40,2,6,It is impossible for everyone in your vicinity to filter out the rude words from their speech.  
310,shittysuperpowers,t2_158qon1l,2020-09-24 07:16:28,10,17,You can teleport at will but only to the seaside town of Blackpool in the north of England.
311,shittysuperpowers,t2_6q7rt,2020-09-24 06:30:31,7,27,Your eyes are made of bacon  
312,shittysuperpowers,t2_17t9t1,2020-09-24 06:00:21,0,5,"You can fasttalk people about why they should become a jehovah's witness until you are completely exausted Your speech never slutters or anything else tied to tiredness or human error,  then you collapse for exaustion when your body reaches the limit."
313,shittysuperpowers,t2_dtzcte,2020-09-24 05:36:27,1,6,"Nickelback songs for receiving nickels Every time someone gives you nickels in your change, you have to count them out and are forced to listen to Nickelback on replay for that many hours."
314,shittysuperpowers,t2_dtzcte,2020-09-24 05:28:34,1,1,"Designated driver hangovers You are the designated driver to one specific club/bar. You can drive people home at light speed in order to get more drunks home. The next day, in honor of your super service, you feel all of their hangovers."
315,shittysuperpowers,t2_55owhc56,2020-09-24 05:18:06,2,17,When you smile everyone smiles back at you.  
316,shittysuperpowers,t2_647uj9h5,2020-09-24 04:41:21,195,9905,NSFW: You can make your ass hairs so thick and dense that when you have diarrhea it comes out as purely filtered water.  
317,shittysuperpowers,t2_833u0rq5,2020-09-24 04:20:43,6,16,Between 3-4 pm you can immediately summon any famous person literally by your side. They really like you for 10 minutes then after that they try and kill you. At 4 pm they get sent back.  
318,shittysuperpowers,t2_65skyl0q,2020-09-24 04:11:03,3,20,You can get that one hair off your tongue on the first try  
