,subreddit,author,created_date,number_of_comments,upvotes,post
319,shittysuperpowers,t2_65skyl0q,2020-09-24 04:09:24,0,0,You can get that one hair off your younger on the first try  
320,shittysuperpowers,t2_3l9sfra1,2020-09-24 03:15:07,4,4,promises made to someone on their deathbed will have the exact opposite effect  
321,shittysuperpowers,t2_55owhc56,2020-09-24 02:39:51,2,13,"When your bladder is full, it becomes a deity that must be worshiped in the eyes of others and a demon that must be killed when it’s empty. It doesn’t actually become a deity or demon. It just effects how people perceive it."
322,shittysuperpowers,t2_2stud90e,2020-09-24 02:38:50,1,17,"You have the ability to be invincible if your standing still, just have a really bad itch in a spot you can’t reach.  "
323,shittysuperpowers,t2_c6ozs1,2020-09-24 01:46:07,3,23,While both of your hands are touching your face you can see perfectly in the dark  
324,shittysuperpowers,t2_5ghflvzj,2020-09-24 01:17:25,2,18,You can turn your fingers into fish fingers YOU CANT CHANGE THEM BACK.
325,shittysuperpowers,t2_3emvpzxy,2020-09-24 00:36:10,2,14,You can read minds and you hear it in a long lost dialect  
326,shittysuperpowers,t2_7xcro04d,2020-09-23 23:47:06,1,13,You can make subways go out of service at will  
327,shittysuperpowers,t2_4iql0c7n,2020-09-23 23:40:06,9,5,"You can control the rate at which time flows for everyone and everything everywhere while maintaining precisely the relativity matrix within which the universe operates. Slower, faster, backwards, forwards -- no objectively measurable change occurs."
328,shittysuperpowers,t2_3ywlewvm,2020-09-23 22:31:47,11,11,You can turn plastic into paper Any type of plastic into any type of paper. You can choose what type of paper. It will stay in the same shape as the plastic item you transformed.
329,shittysuperpowers,t2_6psn2hzr,2020-09-23 22:13:00,3,6,"whenever chewing gum your shoe gets gum on it the worst things that can get on it get on it. whenever chewing gum, your shoe gets gum on it, and the worst things that can get on it, get on it."
330,shittysuperpowers,t2_2zxmeg9y,2020-09-23 21:48:44,1,2,You can loose hair whenever you want and it falls all at once  
331,shittysuperpowers,t2_4sipztn,2020-09-23 21:25:39,1,3,"You can stop someone else from sneezing and it makes you sneeze instead. Or vice-versus: you can stop yourself from sneezing, only to make someone else in the vicinity sneeze."
332,shittysuperpowers,t2_35a3bqgj,2020-09-23 20:41:11,10,17,Turning a computer off and on again fixes every computer problem  
333,shittysuperpowers,t2_67cnc4dk,2020-09-23 20:25:47,3,10,"Every time you break something, it immediately becomes clean hmmmmmm"
334,shittysuperpowers,t2_67cnc4dk,2020-09-23 20:19:32,3,14,you can waterbend the toilet water that you shit in  
335,shittysuperpowers,t2_4r2p6t1k,2020-09-23 20:08:30,1,5,Your penis can switch places with any hole in your body.  
336,shittysuperpowers,t2_7fxiuun5,2020-09-23 20:04:48,4,26,You are biologically immortal. You can’t die of of old age yet you will still be susceptible to diseases and physical trauma  
337,shittysuperpowers,t2_54d0emdx,2020-09-23 20:00:18,1,6,You can make your piss any color if you ate food with that color within 24 hours.  
338,shittysuperpowers,t2_1g19gq2j,2020-09-23 19:26:28,3,14,You can slow time by making people uncomfortable. The more awkward the slower time passes.  
339,shittysuperpowers,t2_z6h4j,2020-09-23 18:15:45,0,8,You can perfectly mimic the voice of Bill Cosby while on television.  
340,shittysuperpowers,t2_33pzidhu,2020-09-23 18:14:26,10,18,You can open a portal to any place in the universe except you cant control the size and it never closes.  
341,shittysuperpowers,t2_3m68v8z1,2020-09-23 17:52:51,7,31,You can weaponize turtles by shoving them in people’s asses  
342,shittysuperpowers,t2_ql9pw,2020-09-23 17:51:32,0,8,You can grind salt and pepper by holding them in your palm and moving your hands as if you are using a salt grinder  
343,shittysuperpowers,t2_6psn2hzr,2020-09-23 17:46:42,6,3,What ever you do will always be reflected back on you except with a 100x multiplier such as hit a person softly your head will explode or you will get severe brain trauma.  
344,shittysuperpowers,t2_2evqvyqi,2020-09-23 17:23:56,1,5,"Everything you see is a flaming homosexual, and people who are flaming homosexual, are straight lawyers  "
345,shittysuperpowers,t2_4cmil1ak,2020-09-23 17:02:00,6,24,"You can fly, just an inch off the ground  "
346,shittysuperpowers,t2_14w1mc,2020-09-23 16:55:08,6,18,Everything you say is a JoJo reference.  
347,shittysuperpowers,t2_4k2lef,2020-09-23 16:20:37,1,16,You can control all of the world’s warm mashed potatoes at once  
348,shittysuperpowers,t2_7e8obje9,2020-09-23 15:32:16,0,10,"People Cannot open the post and see the rest of the text in the discription Ah man, I think I don't have the superpower yet"
349,shittysuperpowers,t2_7e8obje9,2020-09-23 15:31:01,2,14,People can't talk shit behind your back  
350,shittysuperpowers,t2_7e8obje9,2020-09-23 15:28:45,8,37,Your dick appears 2 inches larger when women aren't looking at it  
351,shittysuperpowers,t2_7e8obje9,2020-09-23 15:26:12,3,13,"You can see the future, only the cringy moments that will happen to you and nothing else.  "
352,shittysuperpowers,t2_42usrjvo,2020-09-23 15:21:01,5,72,"Every time you fart, a random person around the world gains the ability to burp 0.1 decibels louder.  "
353,shittysuperpowers,t2_7e8obje9,2020-09-23 15:20:07,2,26,You will not experience the fear of falling off the chair everytime you lean back a little bit too much  
354,shittysuperpowers,t2_47dokn6v,2020-09-23 15:11:52,10,63,"You are Invisible, but only when nothing is looking at you.  "
355,shittysuperpowers,t2_4uv1638b,2020-09-23 15:11:02,4,8,"Whenever you want to rexperience nostalgia, you can time travel to that point of time.  "
356,shittysuperpowers,t2_4uv1638b,2020-09-23 15:02:20,3,26,You can make anybody's farts sould like a song of your choosing.  
357,shittysuperpowers,t2_657n0ij8,2020-09-23 14:48:39,7,9,You can teleport 1-3.Ft in a random direction  
358,shittysuperpowers,t2_7fxiuun5,2020-09-23 14:42:55,4,20,Every chair you sit on has a 70/30 chance of falling apart  
359,shittysuperpowers,t2_3xn7mb7f,2020-09-23 14:37:36,2,46,Your pinky toe has the ability to find the corner of anything while walking or running.  
360,shittysuperpowers,t2_57pcfshm,2020-09-23 14:36:32,5,16,"Everytime you get punched/hurt, a ""harder, daddy"" sound effect plays  "
361,shittysuperpowers,t2_1fdnd9vh,2020-09-23 14:02:56,1,9,You can always get the pre-order bonus for videogames No matter when you buy the game. You can always get the pre-order stuff.
362,shittysuperpowers,t2_5632vcvh,2020-09-23 13:57:13,1,7,Mosquitoes are happy to see you.  
363,shittysuperpowers,t2_4nitgnm5,2020-09-23 13:48:45,0,3,You put a industrial smelter in Roblox Skyblock in another person's chest that is not yours  
364,shittysuperpowers,t2_o81ol,2020-09-23 13:16:24,0,8,The ability to predict the weather everytime you get a migraine.  
365,shittysuperpowers,t2_r438124,2020-09-23 13:13:42,10,185,Every time you strike a pose anyone who looks at you will hear Jojo music in their head  
366,shittysuperpowers,t2_1ndtp4sb,2020-09-23 13:00:14,119,5630,You can slow down any elevator that you are inside  
367,shittysuperpowers,t2_4ef7drd0,2020-09-23 10:41:32,3,13,You are deaf while sleeping.  
368,shittysuperpowers,t2_5w829u5n,2020-09-23 10:20:51,1,6,"Everytime you go take a dump, you become the best singer in the entire world Specially with the song baby from justin bieber ;)"
369,shittysuperpowers,t2_5w829u5n,2020-09-23 10:19:59,7,69,You can tickle anyone at a range of 10 meters  
370,shittysuperpowers,t2_5w829u5n,2020-09-23 10:19:01,2,11,"You can say the n word and black people will see you black everytime you say it, so you good  "
371,shittysuperpowers,t2_5w829u5n,2020-09-23 10:18:13,11,5,Your crush and any girl on the world will consider you attractive Only when you are dressed up as a dragqueen
372,shittysuperpowers,t2_5w829u5n,2020-09-23 10:16:27,10,14,Everytime you touch a dog he will massively cum  
373,shittysuperpowers,t2_1a5puj6t,2020-09-23 09:53:21,3,11,Every door you want to open unlocks immediately  
374,shittysuperpowers,t2_3g2qppwz,2020-09-23 08:56:15,0,10,You can predict tomorrow’s fake news  
375,shittysuperpowers,t2_462n35hu,2020-09-23 08:52:10,4,5,"Whenever you're in a public bathroom, you have the ability to turn into an insect of your choise. You can only turn back into a human in a kitchen Doesn't matter whose kitchen it is"
376,shittysuperpowers,t2_53q41tum,2020-09-23 07:45:55,5,23,You can read people's minds. Everything is translated into a language you can't understand.  
377,shittysuperpowers,t2_4dsmc2j6,2020-09-23 06:54:30,6,18,You can now instantly tell if someone has lost a game of russian roulette.  
378,shittysuperpowers,t2_4eyxg9cq,2020-09-23 05:22:41,4,19,You can orgasm as long as you want while shitting at the same time  
379,shittysuperpowers,t2_833u0rq5,2020-09-23 05:19:47,3,7,"When you kiss someone, wherever you are, a pigeon will find you and shit on you.  "
380,shittysuperpowers,t2_7rq453sd,2020-09-23 05:01:13,1,5,"You are the most Beautiful person alive, only when no one is looking  "
381,shittysuperpowers,t2_7v15vp2w,2020-09-23 04:44:36,6,22,You can make random objects grow hair of any length.  
382,shittysuperpowers,t2_b4pn59d,2020-09-23 04:36:02,1,31,You can telepathically project the comebacks you make in the shower.  
383,shittysuperpowers,t2_3xnxvk0u,2020-09-23 03:52:50,3,0,"You can take any counterfeit money you find, (has to be realistic money so no Monopoly money) and turn it into real money. Money you print counts too"
384,shittysuperpowers,t2_5ams5l0g,2020-09-23 03:36:23,10,16,"Anytime you’re around any kind of corn, it turns into popcorn  "
385,shittysuperpowers,t2_7ml7w3d,2020-09-23 03:11:27,0,2,"On drop down menus where you select your state during online checkout, you can always spin it to exactly your state.  "
386,shittysuperpowers,t2_7kacgb2a,2020-09-23 03:02:56,2,9,Every time you masturbate one of your friends will simultaneously cum with you  
387,shittysuperpowers,t2_1cu01wte,2020-09-23 02:50:57,4,20,You aren’t able to... yeah that’s it you just aren’t able to  
388,shittysuperpowers,t2_105q9o,2020-09-23 02:28:40,3,21,Everytime you get hit by a car it changes color  
389,shittysuperpowers,t2_13kmyweh,2020-09-23 01:30:11,1,16,"You can open up a character customization menu for real people by saying ""Tell me about yourself, are you a boy or a girl?"" to them. Only they get to choose what to change.  "
390,shittysuperpowers,t2_o6b9p9,2020-09-23 01:07:38,1,34,You can change the curvature of beans  
391,shittysuperpowers,t2_8glvw,2020-09-22 23:46:01,4,23,You can grow your toes any length you want.  
392,shittysuperpowers,t2_18ygv5mw,2020-09-22 23:38:23,8,77,"Every time you upvote anything on Reddit, the post gets a free silver award.  "
393,shittysuperpowers,t2_66z0ijew,2020-09-22 23:09:05,7,8,"You summon any object in front of you by scheming at the top of your lungs ""GIVE ME (insert object here)!""  "
394,shittysuperpowers,t2_3wgpna6r,2020-09-22 22:16:46,1,6,You can jump 6 feet in the air. You cannot jump any higher or lower.  
395,shittysuperpowers,t2_6jig7v91,2020-09-22 21:54:36,2,37,You can guess the expiration date of food and drink just by looking at the tag.  
396,shittysuperpowers,t2_6qkie7n7,2020-09-22 21:50:48,46,12,You get to choose your own power in the comments and I reply with side effects Edit: sorry it took so long to reply I forgot I made this post
397,shittysuperpowers,t2_u2yf6,2020-09-22 21:35:29,1,8,You can turn invisible while singing “This is the song that never ends” at the top of your lungs  
398,shittysuperpowers,t2_3vj9yvjn,2020-09-22 21:34:02,4,20,You do not have the ability to be able to  
399,shittysuperpowers,t2_3042x3ql,2020-09-22 21:11:06,8,59,You have all the knowledge of how to play a violin when holding a guitar.  
400,shittysuperpowers,t2_2wdsifug,2020-09-22 20:52:34,1,1,You aren't able to... ^
401,shittysuperpowers,t2_dp1tfbi,2020-09-22 20:29:44,3,13,"Everytime you sneeze, you teleport, you cant control your sneezes or where you teleport to.  "
402,shittysuperpowers,t2_5100hbgj,2020-09-22 20:28:30,3,9,Everything goes in and out the same hole. EVERYTHING  
403,shittysuperpowers,t2_3xkvidv0,2020-09-22 20:26:48,5,2,When you jerk off you nut toxic waste but theres a 10% that with the toxic waste randomly you next meal you will take a violent shit in your first bite  
404,shittysuperpowers,t2_3iegvga0,2020-09-22 20:11:48,2,10,"Everytime you go to sleep, a baby animal will cuddle with you. Naps don't count, animal is randomized (yet domesticated), they disappear as soon as you wake up"
405,shittysuperpowers,t2_4uv1638b,2020-09-22 20:09:20,0,3,"You can super-junp by generating a wildly powerful blast of air beneath your feet. You could also control how high you jump but the force will always be the same after ejection. 

Edit: I meant jump in the title."
406,shittysuperpowers,t2_3l07tu5y,2020-09-22 19:53:43,1,2,You piss the net weight of Niagra Falls  
407,shittysuperpowers,t2_57pcfshm,2020-09-22 19:27:38,0,1,You can give yourself/others backpain  
408,shittysuperpowers,t2_4dos17r5,2020-09-22 18:46:54,1,14,Finding Nerf darts as easy as you lose them. or perhaps godlike
409,shittysuperpowers,t2_ql9pw,2020-09-22 18:37:50,0,6,You can easily catch fish with your bare hands while in a metropolis  
410,shittysuperpowers,t2_ql9pw,2020-09-22 18:34:04,1,10,You can make needles come out of your fingertips like wolverine (you are not immune to the pain they cause)  
411,shittysuperpowers,t2_1lklmubt,2020-09-22 18:13:03,6,16,"You have the ability to talk to any animal, as long as that animal is extinct.  "
412,shittysuperpowers,t2_3ywlvqyv,2020-09-22 18:01:29,0,5,You can turn your cat into a dog anytime you need to dispose of leftovers Only last until the leftovers are gone or when the cat/dog is full
413,shittysuperpowers,t2_7yqqfv01,2020-09-22 17:45:54,0,0,You can only get hard by sucking your nuts in and make at her people hard when you don’t suck your nuts in  
414,shittysuperpowers,t2_202oqsww,2020-09-22 17:08:35,3,8,The ability to learn and play any song in the world on guitar at request.  
415,shittysuperpowers,t2_thifh,2020-09-22 17:01:26,2,7,"You always have a $5 bill on your person My wife and I were talking about this the other day. Sure, you could get something cheap. It would even be possible to pay larger bills, $5 at a time, but it sure would be a hassle.

A more useless variant would be that you can spawn a $5 bill once per day. Still handy sometimes (great for tipping!) but not so super."
416,shittysuperpowers,t2_7e8obje9,2020-09-22 16:45:21,0,9,Naruto run grants 30% speed increase only when you're being filmed  
417,shittysuperpowers,t2_6bnwioeu,2020-09-22 16:35:34,5,47,"Whenever you say “Or is it?”, Vsauce music starts playing  "
418,shittysuperpowers,t2_5632vcvh,2020-09-22 16:35:24,0,10,"You can play any wildly inappropriate song on any instrument with perfect vocals any time. For example, you can sing 'akuna matata' while on fire."
419,shittysuperpowers,t2_34qcnlj2,2020-09-22 16:31:55,2,7,You can make your enemy google search result always start from the last page  
420,shittysuperpowers,t2_bca8l,2020-09-22 15:56:38,18,59,"Whenever someone says «I’m so hungry I could eat a whole (insert animal)» you can summon said animal and the person is forced to eat it. Skin and bones, raw and in one sitting."
421,shittysuperpowers,t2_58u0d6si,2020-09-22 15:54:56,3,8,Every door you walk by you get your shirt caught on the handle Regards of if there is even a handle it'll get caught on something.
422,shittysuperpowers,t2_55owhc56,2020-09-22 15:34:13,6,11,"You can change alcohol into water. The power is limited by visual range, meaning you have to be able to see the alcohol. A mass alcohol-to-water nuke, from the mind, would be too powerful for this thread."
423,shittysuperpowers,t2_4chyqnin,2020-09-22 15:04:46,10,52,You can move your dick like you move your arm  
424,shittysuperpowers,t2_7exlwfkg,2020-09-22 15:04:32,0,13,"Every time your poop weighs more than 5 ounces total, someone’s bud light is replaced with pineapple juice It can be one poop nugget or overall"
425,shittysuperpowers,t2_1s20rttv,2020-09-22 14:25:14,2,18,You win every armwrestle at the cost of shitting yourself As title says.. You shit yourself every time you win an armstrestle
426,shittysuperpowers,t2_2yjj695c,2020-09-22 14:22:12,1,1,You are able to know what someone's last name would be if all their ancestors got their last name from their other parent  
427,shittysuperpowers,t2_2hnvykkf,2020-09-22 13:43:37,0,7,"You can open a water bottle flawlessly Zero struggle, you open it with the same crack but as though it was already opened, with ease"
428,shittysuperpowers,t2_178q23,2020-09-22 13:36:17,0,15,You can open any type of door if you have 40 thieves with you.  
429,shittysuperpowers,t2_3m6yko6p,2020-09-22 13:28:22,4,16,You have the ability to stop seeing sperm/sex/nut posts Could also be known as removing nsfw posts
430,shittysuperpowers,t2_7ye3w05g,2020-09-22 13:04:13,0,2,"Whenever you are hungry, a can of baked beans will spawn right next to you, regardless if you want them or not  "
431,shittysuperpowers,t2_1e85zfo9,2020-09-22 13:01:25,5,28,You can literally talk out of your ass  
432,shittysuperpowers,t2_4ybn2qss,2020-09-22 11:31:03,16,116,You change your gender after having sex. oragsm is optional
433,shittysuperpowers,t2_4lavvldj,2020-09-22 11:23:34,7,45,"Every time you eject,you know how many sperm there are and know their name Edit:Their name is randomly generated and you could change their name at any moment."
434,shittysuperpowers,t2_3jf6acho,2020-09-22 11:19:01,6,8,"You think so fast, that everything seems to be in super slomo for you. You cant switch it off so you have too stay in class for a loooong time.  "
435,shittysuperpowers,t2_e7irnq7,2020-09-22 10:09:47,0,1,You are invincible also you will be fully aware of your own breathing for ever.  
436,shittysuperpowers,t2_4twpb25q,2020-09-22 09:41:11,3,25,"You can eat and digest diamonds They propably won't taste pretty good, but you can."
437,shittysuperpowers,t2_ll7hqdq,2020-09-22 08:23:00,33,2337,"You can see and talk to dead people. They don't say or do anything, themselves though, because they're dead.  "
438,shittysuperpowers,t2_51h9hlnl,2020-09-22 08:01:02,0,4,"You can fly, execpt only upwards. The only way to come down would be to pull yourself back towards the earth by grabbing a poll or something."
439,shittysuperpowers,t2_15e8aj,2020-09-22 07:47:15,9,61,"When you hold your breath, you can fall through water like it is air.  "
440,shittysuperpowers,t2_7qzi2gcq,2020-09-22 07:37:04,1,4,"You morph into Koolaid man anytime you say ""Oh yeah""  "
441,shittysuperpowers,t2_69sxwep8,2020-09-22 07:15:50,3,6,"You can summon a magic blue shelf that can't be touched, and disappears after 2 minutes.  "
442,shittysuperpowers,t2_14w1mc,2020-09-22 07:01:53,10,20,"For every 100 TikTok videos you watch, a random TikToker dies.  "
443,shittysuperpowers,t2_xd4r6,2020-09-22 06:39:05,0,6,You can break blocks in minecraft by punching your monitor  
444,shittysuperpowers,t2_6hen34pn,2020-09-22 06:34:34,8,121,You can transform to a rock when you're 600 feet deep in the Bermuda Triangle  
445,shittysuperpowers,t2_2ml6tpaz,2020-09-22 05:42:12,2,4,You can sleep with your eyes open  
446,shittysuperpowers,t2_4jv47p00,2020-09-22 05:34:40,1,6,"You can summon a dog that sings thomas the tank engine theme song, everytime you are in a intense situation.  "
447,shittysuperpowers,t2_2hx8wc33,2020-09-22 05:13:09,2,16,"Every time you take a shit, it points in the direction of buried treasure. So basically which ever way your shit is pointing there’s buried treasure. It could be right next to you or a thousand miles away. And as they say, X marks the spot."
448,shittysuperpowers,t2_2vkcny1v,2020-09-22 05:06:12,5,40,"Bean Bender. You bend beans. That's it You can control beans if there are any in your vicinity, like avatar can with water, air ect."
449,shittysuperpowers,t2_47lxjqty,2020-09-22 05:03:24,5,19,"No matter what happens, you don't smell like anything.  "
450,shittysuperpowers,t2_833u0rq5,2020-09-22 04:53:22,4,4,The only time you can sleep is after sex.  
451,shittysuperpowers,t2_7qzi2gcq,2020-09-22 04:48:16,0,1,You can speak all lenguages mixed together.  
452,shittysuperpowers,t2_5bmv2o9v,2020-09-22 04:46:27,2,5,In the game Among Us you can always get the admin card swipe on your first try  
453,shittysuperpowers,t2_2ml6tpaz,2020-09-22 04:43:38,0,9,"You can cause anyone within a closed area that you're also in, to fart simultaneously I meant everyone not anyone."
454,shittysuperpowers,t2_6nzmr7dl,2020-09-22 04:36:04,1,1,"Everytime you dont like someone, there is a 50% chance all of your pounds get turned into jelly beans... it has to be pounds, if you dont have any then consider yourself lucky.  "
455,shittysuperpowers,t2_6nzmr7dl,2020-09-22 04:30:04,0,4,"Everytime you say what type of doritos you like most, you can change your nose to be a coffee dispenser and vice versa.  "
456,shittysuperpowers,t2_4mzcgkky,2020-09-22 04:20:00,4,4,"While watching a movie, whatever outcome you thought would happen, happens.  "
457,shittysuperpowers,t2_4i3mv1ct,2020-09-22 04:06:08,3,11,"You can talk to any God, except he doesnt talk back  "
458,shittysuperpowers,t2_32cnndkh,2020-09-22 04:05:45,1,4,You have the power to work any shower handle instantly.  
459,shittysuperpowers,t2_833u0rq5,2020-09-22 04:03:16,2,7,When you hold your breath you float up like a hot air ballon.  
460,shittysuperpowers,t2_15e8aj,2020-09-22 04:01:26,8,40,Your diaries write themselves as you go about your day.  
461,shittysuperpowers,t2_5emwh1ye,2020-09-22 03:59:57,0,6,When you look at a tree you know the exact amount of leaves.  
462,shittysuperpowers,t2_5csp7wg6,2020-09-22 03:40:39,1,5,Every time you punch a tree there's a 50% chance you'll hear the minecraft theme  
463,shittysuperpowers,t2_5csp7wg6,2020-09-22 03:33:23,3,9,You can cum on command  
464,shittysuperpowers,t2_ic90j,2020-09-22 03:18:35,2,16,You can fart the price of venti Pumpkin Spice Latte. The money you get is in local currency.
465,shittysuperpowers,t2_4iavcbzb,2020-09-22 03:15:04,1,5,"Clapping instantly turns all of the money under your name into reddit karma, additionally, once you clap once it’s turned on indefinitely and any money you earn henceforth is automatically karma  "
466,shittysuperpowers,t2_omf2yrh,2020-09-22 03:03:56,0,8,Your food out of the microwave is always partially cold  
467,shittysuperpowers,t2_1wiwzkdc,2020-09-22 02:33:05,2,21,You can’t overdose on vitamin gummies anymore  
468,shittysuperpowers,t2_759k84bh,2020-09-22 02:26:03,1,6,You can make dead meme sounds when you try to vocalize them  
469,shittysuperpowers,t2_ql9pw,2020-09-22 02:16:12,0,3,"You can turn all stray hairs in the room that you are in into a hairball that gets thrown up by the nearest living creature that can pass it without trouble. Edit: Excluding you, of course."
470,shittysuperpowers,t2_5p90n46c,2020-09-22 01:34:38,7,51,You can teleport anywhere after counting to 1 million with no interruption  
471,shittysuperpowers,t2_4np17yii,2020-09-22 00:52:24,0,18,You get an alert whenever someone's mom is about to beat their ass.  
472,shittysuperpowers,t2_57p44h9l,2020-09-22 00:46:18,0,8,"Once per day, you can cause someone's piss to smell like asparagus at will.  "
473,shittysuperpowers,t2_60wda75h,2020-09-22 00:20:26,5,16,"Every time you take a shit, you gain one cent.  "
474,shittysuperpowers,t2_86gx2vxd,2020-09-22 00:15:19,0,0,Phone text look up spokeo &lt;script async src='https://www.spokeoaffiliates.com/v2/banners/get-phone-banner.js?type=free_reverse_phone_lookup&amp;v=102&amp;ftype=phone' type='text/javascript'&gt;&lt;/script&gt;&lt;a class='banner_container' data-affiliate-key='A4596216377' href='https://www.spokeoaffiliates.com/v2/banners/phone?type=free_reverse_phone_lookup&amp;v=102&amp;ftype=phone' id='free_reverse_phone_lookup_v102'&gt;www.spokeo.com&lt;/a&gt;&lt;noscript&gt;&lt;iframe alt='Spokeo Phone Lookup' frameborder='0' height='250' scrolling='auto' src='https://www.spokeoaffiliates.com/v2/banners/phone?type=free_reverse_phone_lookup&amp;v=102&amp;ftype=phone' width='300'&gt;&lt;/iframe&gt;&lt;/noscript&gt;
475,shittysuperpowers,t2_4wp8glei,2020-09-22 00:12:10,1,7,"Every time you jump the height you jump doubles from the previous jump Simply you jump and then the next time the you jump you go twice as high. So say you jump 1 1/2 feet, the next time you jump you go 3 feet, then the next time you jump 6 feet and so on."
476,shittysuperpowers,t2_5fqnmt2n,2020-09-21 23:56:05,2,2,You can turn vegans into cooked steak  
477,shittysuperpowers,t2_6fbwx20v,2020-09-21 23:55:27,3,1,You can only turn legos into jelly AFTER stepping on them  
478,shittysuperpowers,t2_3iegvga0,2020-09-21 23:50:28,0,8,Your genitals sounds like maracas white every motion.  
479,shittysuperpowers,t2_6k7ehywh,2020-09-21 23:30:40,0,31,"Whenever you have a song stuck in your head, everyone in close proximity can hear it.  "
480,shittysuperpowers,t2_55owhc56,2020-09-21 23:25:53,3,19,You can make your skin invisible.  
481,shittysuperpowers,t2_9pw3f62,2020-09-21 23:20:11,5,29,You shoot rainbows out of your hands that turns people gay  
482,shittysuperpowers,t2_an1vk,2020-09-21 22:57:44,0,3,All of your reddit posts are successful on the 21st night of September  
483,shittysuperpowers,t2_3nvvqnu2,2020-09-21 22:44:20,0,9,every time you sneeze there’s a 1% chance that you dont  
484,shittysuperpowers,t2_4lydtmnx,2020-09-21 22:25:26,0,5,Everytime you you jump you can levitate for how long your in the air for.  
