,subreddit,author,created_date,number_of_comments,upvotes,post
667,shittysuperpowers,t2_12dh0d,2020-09-19 03:09:35,2,5,"When you're nervous, you see everyone around you bald  "
668,shittysuperpowers,t2_1e85zfo9,2020-09-19 03:02:21,1,7,You can make people you don’t like have nightmares about you  
669,shittysuperpowers,t2_2j97apbr,2020-09-19 02:25:49,2,18,You can make other people's buttcracks horizontal instead of vertical  
670,shittysuperpowers,t2_7tglsw8g,2020-09-19 02:18:44,3,6,Raising your hand as you would to request something.. A random person will appear from outta nowhere to assist you with whatever you need. They smell bad. And their help is inadequate. And they may try to steal your things.
671,shittysuperpowers,t2_13bjuxp8,2020-09-19 02:14:07,2,4,Your fart sounds like your lastly heard musical instrument.  
672,shittysuperpowers,t2_4np17yii,2020-09-19 02:05:56,1,8,Whenever you get hit in the balls all men around you feel it as well.  
673,shittysuperpowers,t2_6jlwejco,2020-09-19 02:04:57,4,3,You can point to any location on a globe only when your eyes are closed  
674,shittysuperpowers,t2_6k7qz8ps,2020-09-19 01:54:30,4,9,You can pee faster by physically widening your urethra with your mind  
675,shittysuperpowers,t2_7ffj9nyq,2020-09-19 01:40:39,2,2,You can synchronize with someone and manipulate him/her if you have to be naked and say I’m gay first. Sorry if my grammar is not correct.
676,shittysuperpowers,t2_5bmv2o9v,2020-09-19 01:25:53,1,3,You can sumion any thing or substance in a general location. The Catch is it can be ANY THING OR SUSTANCE and you have no idea what will appear or how much.  
677,shittysuperpowers,t2_4vir2mca,2020-09-19 01:15:08,4,26,"Every time you think something like “I wish this would happen”, reality splits into two timelines, one where it does happen, one where it doesn’t, and your conscience remains on the timeline where nothing happened  "
678,shittysuperpowers,t2_659e3dzp,2020-09-19 01:08:56,1,10,You can go invisible only while no one is looking or can see you  
679,shittysuperpowers,t2_7da0l2im,2020-09-19 01:08:19,0,5,You can tell if a gun is empty or jammed only after it fires  
680,shittysuperpowers,t2_45myogsy,2020-09-19 01:05:27,3,3,"You excrete a random object from any orifice of your body every day. Could be a marble, could be the sun, could be Jonathan Joestar, or a metric ton of hentai. If you can think of it, you can piss it, shit it, barf it, sneeze it, sweat it, or it could leave through your pores"
681,shittysuperpowers,t2_nxleoci,2020-09-19 00:10:51,3,13,You can steal other people's toes- transferring their toes directly onto your own feet  
682,shittysuperpowers,t2_178q23,2020-09-19 00:05:34,1,5,You can turn traffic lights to red with your mind.  
683,shittysuperpowers,t2_4iql0c7n,2020-09-18 23:59:30,0,9,"You can speak in tongues. Ancient, dead, secret, whatever... You can speak them but nobody can understand them, not even yourself."
684,shittysuperpowers,t2_3g9p1r2,2020-09-18 22:44:11,0,2,You can make your genitals sparkle by flashing people They'll shine bright like a diamond
685,shittysuperpowers,t2_4jqclin6,2020-09-18 22:39:25,5,13,Whenever you say “Is it possible to learn this power” you immediately learn it  
686,shittysuperpowers,t2_7snn4zbr,2020-09-18 22:09:59,5,41,You can give people second aid.  
687,shittysuperpowers,t2_3iegvga0,2020-09-18 21:05:56,0,4,"You know exactly when a video game is going to be released/launched and get it 2 months early when pre-ordered. You must eat an entire bag of Sugar Free Gummy Bears, 5LBS by Albanese Confectionery."
688,shittysuperpowers,t2_4vkhe02b,2020-09-18 21:04:37,6,45,Have a healing factor that heals any wound 0.15% faster  
689,shittysuperpowers,t2_5k6usupy,2020-09-18 20:15:50,3,14,"You can shoot sticks out your asshole after eating sticks, it hurts while shooting them out.  "
690,shittysuperpowers,t2_4kwfq8we,2020-09-18 19:42:26,3,15,You are gifted constant post-nut clarity. Do with it what you must.
691,shittysuperpowers,t2_5oot3hi3,2020-09-18 19:25:53,6,8,You can make people drop things except it only works on alternating tuesdays  
692,shittysuperpowers,t2_eqo8r,2020-09-18 19:25:12,0,6,Whenever you flip someone off it’s censored in real life  
693,shittysuperpowers,t2_7e8obje9,2020-09-18 19:08:03,4,28,You can change the name of this subreddit into r/shittysuperpowers and no one will remember what it was originally called  
694,shittysuperpowers,t2_4clle1rs,2020-09-18 19:01:15,3,10,You can see where other people are looking via 2 red lasers coming out of their eyes. You can’t turn it off
695,shittysuperpowers,t2_84u84sox,2020-09-18 18:52:12,1,6,You have night vision... You have night vision but only when you close your eyes
696,shittysuperpowers,t2_1oj7dlje,2020-09-18 18:51:49,0,7,You can make your knuckles bleed whenever you punch a hard object  
697,shittysuperpowers,t2_umd5bxf,2020-09-18 18:41:11,158,5946,You can break anyone’s bone by breaking your own bone  
698,shittysuperpowers,t2_9inj74a,2020-09-18 18:26:29,2,22,You can tie your shoes while running  
699,shittysuperpowers,t2_4zkbinxf,2020-09-18 17:26:55,1,8,Your gaming skills are highly enhanced when playing mobile games.  
700,shittysuperpowers,t2_69dota0y,2020-09-18 17:23:30,3,19,You can control your crush's mind by crushing yourself in a trash compactor  
701,shittysuperpowers,t2_7mhzy3on,2020-09-18 17:10:45,1,7,You have the ability to bend kitchenware when you sneeze  
702,shittysuperpowers,t2_446xr6e3,2020-09-18 17:00:12,12,44,You can absorb and use other people's superpowers  
703,shittysuperpowers,t2_7imq2sxy,2020-09-18 16:15:56,5,26,You can make anyone's game crash before they save it  
704,shittysuperpowers,t2_6c7pze4d,2020-09-18 16:11:53,4,12,You can speed up or slow down time But only your perception of it.
705,shittysuperpowers,t2_6xe2ho7h,2020-09-18 15:51:47,0,6,your hands have turned to sponge and you can suck whole lakes at a time. when you drain the sponge your hand break and you either have to suffer a hand break every few months or just have insanely wet hands all day  
706,shittysuperpowers,t2_7e8obje9,2020-09-18 14:52:40,6,19,Eating an m&amp;m changes the colour of your piss into the colour of m&amp;m  
707,shittysuperpowers,t2_7e8obje9,2020-09-18 14:48:57,13,74,Everytime you sneeze the person closest to you does a backflip  
708,shittysuperpowers,t2_nxleoci,2020-09-18 14:25:33,16,131,You can shoot your teeth out of your mouth like a gun  
709,shittysuperpowers,t2_nxleoci,2020-09-18 14:23:23,4,12,You can instantly cover you hands in raw chicken juice to wipe on your enemies  
710,shittysuperpowers,t2_39ijjiu9,2020-09-18 14:17:07,2,19,"You can see what your dog is barking at, even from a few miles away.  "
711,shittysuperpowers,t2_6xs96ui8,2020-09-18 14:01:59,2,17,You’re amazing at video games that you hate.  
712,shittysuperpowers,t2_5b8oxdg6,2020-09-18 13:35:20,1,7,"You now cum ice cream, which contains your semen/egg cells, set at 10°C inside your balls/ovaries. The ice cream cannot go below 10°C unless it exits your body, either from being ejaculated out or having the part where it is stored removed."
713,shittysuperpowers,t2_6qo5yed4,2020-09-18 13:29:47,4,5,you can turn your teeth into chewing gum they don't grow back and you can't turn them back
714,shittysuperpowers,t2_2o4izpl1,2020-09-18 13:18:51,3,12,Every time you shit in a toilet the creator of the toilet can smell it  
715,shittysuperpowers,t2_69dota0y,2020-09-18 13:06:27,7,39,You can prevent yourself from immediately having to have to use the restroom after drinking a cup of coffee Honestly I think this is actually a pretty damn good superpower imo. Just wanted to share it with you all
716,shittysuperpowers,t2_4240a90b,2020-09-18 12:54:36,0,5,You know who made a number 2 in a bathroom by the smell  
717,shittysuperpowers,t2_7da0l2im,2020-09-18 12:50:13,5,48,Anytime you sneeze a soft voice whispers ‘Bless you into your ear’ no matter where you are Edit: Yes the grammar is wrong I’m sorry I can’t change it
718,shittysuperpowers,t2_4sotzx5j,2020-09-18 12:34:38,3,7,"You have the ability to speak any language on earth, given you hate the people who speak it.  "
719,shittysuperpowers,t2_7da0l2im,2020-09-18 12:09:15,1,13,Your password is always expectable not matter the length or lack of symbols  
720,shittysuperpowers,t2_55owhc56,2020-09-18 12:02:08,16,79,"If you’re wearing a button up shirt, unbutton the middle button and reach inside, a time portal opens and you can touch your past self.  "
721,shittysuperpowers,t2_15e8aj,2020-09-18 11:27:57,4,18,"Projectiles and melee attacks will pause briefly right before they hit you, before continuing at their original velocity.  "
722,shittysuperpowers,t2_15e8aj,2020-09-18 11:27:23,2,10,"Your blood can shift through the solid, liquid and gaseous states.  "
723,shittysuperpowers,t2_7e8obje9,2020-09-18 11:14:18,8,306,You can change a redditors name to [deleted]  
724,shittysuperpowers,t2_7e8obje9,2020-09-18 11:11:09,0,13,You can make anyone who is sorting by new upvote your post But it stops when it reaches hot
725,shittysuperpowers,t2_7e8obje9,2020-09-18 11:09:34,1,28,"You can make people get the urge to watch ""never gonna give you up"" volunteerily and in this way you can Rick roll people in real life.  "
726,shittysuperpowers,t2_7e8obje9,2020-09-18 11:06:56,5,99,"You can make anyone hum ""never gonna give you up""  "
727,shittysuperpowers,t2_7e8obje9,2020-09-18 11:06:29,64,868,You can make songs get stuck in peoples head  
728,shittysuperpowers,t2_24ag8zin,2020-09-18 11:06:15,4,26,"You can see through things once a day, during 12 seconds and after use your power you can't see nothing for 6 hours  "
729,shittysuperpowers,t2_84vlz3q2,2020-09-18 10:51:30,2,22,You can barf lava if you think about a freaky-looking scarecrow 10 minutes beforehand  
730,shittysuperpowers,t2_5ihk4zq5,2020-09-18 10:09:43,11,27,You speak Spanish when you're happy  
731,shittysuperpowers,t2_4ixh6nw7,2020-09-18 09:49:41,1,14,You can hear animals insult you  
732,shittysuperpowers,t2_4gs77yt0,2020-09-18 08:54:34,0,8,You can convince anyone anything as long as you can get them to say poggers. The effect wears off after every use. It doesn't count if they say poggers without you telling them to/tricking them into saying it. Only works on one person at a time.  
733,shittysuperpowers,t2_1zuhzwo6,2020-09-18 08:43:07,3,14,You have the power to turn any piece of paper in your field of vision into a shitty paper airplane that always nosedives.  
734,shittysuperpowers,t2_61nwog9j,2020-09-18 08:21:36,0,8,You have the ability to read minds for brief periods of time. This superpower is activated like a spore and appears in the form of cystic facial and body acne.  
735,shittysuperpowers,t2_4s8gfo1q,2020-09-18 08:20:22,3,22,When you kill yourself you become invisible  
736,shittysuperpowers,t2_4dkejqml,2020-09-18 07:34:43,1,9,"You can move twice as fast, with half the energy.. But every step makes the noise from the spongebob boots episode"
737,shittysuperpowers,t2_4y3hjrl7,2020-09-18 07:27:33,3,13,You can print fake money with your fingers  
738,shittysuperpowers,t2_15e8aj,2020-09-18 06:39:07,3,38,Your nerves can transmit signals to nearby people instead of yourself.  
739,shittysuperpowers,t2_7kz2qw5f,2020-09-18 06:26:43,0,11,You can see a counter that says the number of words you have said in your life till now.  
740,shittysuperpowers,t2_55owhc56,2020-09-18 05:56:17,4,11,"You can let animals eat you and shit you out. After you’re out, you can become whole and repeat the process.  "
741,shittysuperpowers,t2_1fdp0xyf,2020-09-18 05:46:59,3,9,You can see 1 second of future Like what are you going to do after 1 sec.
742,shittysuperpowers,t2_4imy2vig,2020-09-18 05:31:00,6,19,"U are very good at shooting with a gun, This only works when you point the gun at yourself.  "
743,shittysuperpowers,t2_1zuhzwo6,2020-09-18 05:27:29,7,33,Your teeth can bite clean through anything with ease That includes your tongue
744,shittysuperpowers,t2_5wahklws,2020-09-18 04:52:58,7,13,You can make girls in your area have crush on you best friend  
745,shittysuperpowers,t2_15e8aj,2020-09-18 04:26:20,4,11,You can peel off online advertisements from the screen.  
746,shittysuperpowers,t2_527egsdc,2020-09-18 02:41:41,6,28,"You have the power to instantly change porn to a YouTube video whenever somebody walks in on you jerking off. Unfortunately, there is an error which gives the 10% chance of switching to hardcore midget porn.  "
747,shittysuperpowers,t2_52wht508,2020-09-18 02:35:43,4,11,You can redirect all piss streams at will  
748,shittysuperpowers,t2_3iegvga0,2020-09-18 02:12:48,2,4,"You know exactly how the world works Everything is changed to porn logic ( think lemon stealing whore logic ), but no one has sex. Just *heavy* sexual tension."
749,shittysuperpowers,t2_3fz3a5v2,2020-09-18 00:51:25,9,19,You stop time every second your eyes are closed. Time only resumes when your eyes are open.
750,shittysuperpowers,t2_2ui51ziy,2020-09-18 00:08:14,4,10,If you tell I AM THE HULK in a area with more than 150 people in a 1 square kilometer area you gain gain the power of the hulk for 10 seconds  
751,shittysuperpowers,t2_34vivk5r,2020-09-17 23:57:35,2,9,"you can piss out of your fingers, if you pose it as a fingergun  "
752,shittysuperpowers,t2_34vivk5r,2020-09-17 23:54:37,4,24,You can turn invisible if you cover yourself in vinegar  
753,shittysuperpowers,t2_5dl6ytr3,2020-09-17 23:42:59,6,10,.sdrawkcab daer nac uoY  
754,shittysuperpowers,t2_z5iej,2020-09-17 23:41:41,1,10,You can cause mass brain hemorrhages in a 10 foot radius around yourself This also includes you
755,shittysuperpowers,t2_4krm0e14,2020-09-17 23:32:40,1,12,"When in serious danger, you can land a bottle flip perfectly every time!  "
756,shittysuperpowers,t2_4np17yii,2020-09-17 22:58:19,1,9,Everytime you pop something it'll sound like bubble wrap.  
757,shittysuperpowers,t2_4iql0c7n,2020-09-17 22:48:54,12,8,You can get blood from a stone.  
758,shittysuperpowers,t2_3i4pygv,2020-09-17 22:21:14,1,10,You can aim your fingernail clippings with 85% accuracy  
759,shittysuperpowers,t2_55owhc56,2020-09-17 22:17:06,1,10,You can make yams intelligent.  
760,shittysuperpowers,t2_2zyzopnv,2020-09-17 22:00:16,4,10,Your waifu becomes real once you get a girlfriend  
761,shittysuperpowers,t2_4qdibvw2,2020-09-17 21:48:54,4,21,You can play any national anthem at any time But you have to open your mouth
762,shittysuperpowers,t2_3t5d6wfy,2020-09-17 21:36:59,1,8,You can turn invisible yet you can’t become visible again  
763,shittysuperpowers,t2_69dota0y,2020-09-17 21:24:11,2,14,You can turn water into non-alcoholic wine  
764,shittysuperpowers,t2_79j70u5e,2020-09-17 20:01:02,256,9701,ɹǝɓuɐp ǝʇɐᴉpǝɯɯᴉ uᴉ ǝๅᴉɥʍ uɐᴉๅɐɹʇsnɐ uᴉ ǝdʎʇ uɐɔ noʎ ᴉd ɹǝɓᴉʇ ǝɥʇ uᴉ ๅๅǝɟ ᴉ dๅǝɥ ǝsɐǝๅd ǝuoǝɯos uɐɔ
765,shittysuperpowers,t2_4dv8v03v,2020-09-17 19:59:59,0,16,"Whenever you show anyone a picture, the disembodied voice of nickleback will sing ""look at this photograph"" Totally don't put that as your ring tone and have a buddy hiding nearby and call you when you show someone a picture."
766,shittysuperpowers,t2_5audzzun,2020-09-17 19:39:58,1,11,Blood tastes like water. You’re a vampire.
767,shittysuperpowers,t2_4u7xjzke,2020-09-17 19:28:41,3,14,"Grass moves out of the way when you walk. And it never comes back, you just leave behind soil paths when you walk on grass."
768,shittysuperpowers,t2_2odgza7a,2020-09-17 19:17:58,1,6,You can drink your sweat. That's it  
769,shittysuperpowers,t2_1vx6x7f,2020-09-17 18:59:36,12,7,"Every time you shove an animal up your ass you get their powers Every time you shove an animal up your ass, like ALL the way in there. you get their powers. Like you shove a spider up there? Shoot webs like spiderman. Shove a chameleon up there? Able to change your skin color as camouflage. Shove a turtle up your ass? Grow a giant ass shell on your back. Shove a squirrel up there? Have a wingsuit out of the skin. Shove a fish up there? Breath underwater

Yes, you have to be able to fit it in your ass, yes. you'd have to be able to take it back out or else you're stuck like it. And yes, the animal is NOT harmless while up in there. You can still feel it in there and it can sting you. and if the animal dies, you lose the power with a dead animal stuck in your ass."
770,shittysuperpowers,t2_2n66ba7m,2020-09-17 18:44:51,3,78,"When you pee, you pee all of it. You never have that post-piss dripping anymore. You will still pee like normal, and as many times as you normally do, but after you finish, you truly finish."
771,shittysuperpowers,t2_7tglsw8g,2020-09-17 18:04:16,2,2,"Whenever you watch porn, your screen and selfie camera gets shared to all the women that you love cell phone or computer.  "
772,shittysuperpowers,t2_3kzumk69,2020-09-17 18:01:59,20,41,"You can turn any book that contains the word ""famine"" into a potato  "
773,shittysuperpowers,t2_3kzumk69,2020-09-17 17:42:47,10,7,You can command my pet crab by sending a string of emojis under this post Example: 🦀➡️🍳🍪
774,shittysuperpowers,t2_7tglsw8g,2020-09-17 17:40:00,5,38,All of your vital organs are bulletproof. And they all weigh an extra 5lbs each.  
775,shittysuperpowers,t2_3bb7rh1h,2020-09-17 17:35:26,1,18,You can shoot skim milk out of your right nipple at 60 psi on command  
776,shittysuperpowers,t2_2421cf9r,2020-09-17 17:24:35,9,47,Whenever you close your eyes you cant hear.  
777,shittysuperpowers,t2_714wqvhd,2020-09-17 17:13:31,2,9,You can clean anything you touch As long as it’s exactly 42 degrees Fahrenheit
778,shittysuperpowers,t2_57pcfshm,2020-09-17 17:10:44,8,15,You can slap people through the internet  
779,shittysuperpowers,t2_5rbrjwpj,2020-09-17 16:27:30,7,30,Your pee is made of cum and your cum is made of pee  
780,shittysuperpowers,t2_5rbrjwpj,2020-09-17 16:25:35,8,2,The smell of farts makes you horny at least you aren't disgusted by it
781,shittysuperpowers,t2_7t4oq34e,2020-09-17 16:16:53,3,7,You can transform any normal food into its canned varient and vice versa.  
782,shittysuperpowers,t2_4zkbinxf,2020-09-17 16:08:48,1,15,Your driving skills are significantly increased when u drive a car with its engine turned off.  
783,shittysuperpowers,t2_55owhc56,2020-09-17 16:06:51,1,5,You can change the color of your undershirt at will.  
784,shittysuperpowers,t2_50xlcv2h,2020-09-17 16:00:32,8,25,You have eyes at the back of your head. ONLY THE BACK OF YOUR HEAD.  
785,shittysuperpowers,t2_7tglsw8g,2020-09-17 15:55:35,1,9,"Whenever you focus on a conversation, you get amnesia. Amnesia goes away when not focused on a conversation.  "
786,shittysuperpowers,t2_2odgza7a,2020-09-17 15:37:20,0,3,You can like pictures on instagram with thought everytime you want  
787,shittysuperpowers,t2_6mwsprpp,2020-09-17 15:36:21,0,7,You can play anything like a piano.  
788,shittysuperpowers,t2_8glvw,2020-09-17 15:32:03,1,7,"You have the power to dry the swampiest of asses, butt never have a dry ass of your own.  "
789,shittysuperpowers,t2_7tglsw8g,2020-09-17 15:28:17,2,5,"Every time you laugh, you immediately step in shit.. I haven't laughed so much as I have on this forum."
790,shittysuperpowers,t2_7tglsw8g,2020-09-17 15:20:00,3,14,"When You close your eyes you can still see, tho everything is blurry, and in black and white. And I mean EVERYTHING is blurry."
791,shittysuperpowers,t2_4qjw1jdi,2020-09-17 14:48:24,4,49,"You can listen to exactly what your dog is thinking, though he/she thinks in barks.  "
792,shittysuperpowers,t2_69dota0y,2020-09-17 14:29:51,2,3,You can turn into pigeon poop that always misses that car or person by one inch (25.4 mm)  
793,shittysuperpowers,t2_69dota0y,2020-09-17 14:27:58,0,6,You can turn into the lord of the flies and have flies worship you.  
794,shittysuperpowers,t2_3srb2ykh,2020-09-17 14:02:33,1,3,You have the reflexes of a flie only when you are reading a book.  
795,shittysuperpowers,t2_1et8ga84,2020-09-17 13:13:18,2,32,Your items drop when you die.  
796,shittysuperpowers,t2_57pcfshm,2020-09-17 13:11:43,3,15,"Whenever you get stressed, bubbles start coming out of your ears  "
797,shittysuperpowers,t2_7ffj9nyq,2020-09-17 12:02:42,3,7,"Every time you finish something,there is someone behind.  "
798,shittysuperpowers,t2_71ch314x,2020-09-17 11:50:25,2,5,You will automatically say “I HAVE BONER” whenever someone passes  
799,shittysuperpowers,t2_5psofz3j,2020-09-17 11:24:36,2,23,"When you see the number 69, the smash brothers announcer voice will say nice.  "
800,shittysuperpowers,t2_4cx2e4jr,2020-09-17 11:09:47,4,10,You can tell the flavour of crisps just by looking at them  
801,shittysuperpowers,t2_j70dw,2020-09-17 10:40:43,5,17,You Can Have Rabid Animals Bite Karens on Command But only Karens and Anti-Vaxxers because otherwise they'll completely ignore you.
802,shittysuperpowers,t2_4ehsvaxt,2020-09-17 09:49:15,3,8,"If you think about dying, you die and make a perfect clone of yourself next to your dead body, and live on in the new body.  "
803,shittysuperpowers,t2_2u8tnktx,2020-09-17 09:42:16,2,2,Mod advance requiem power You now have spider sense that only works around mods
804,shittysuperpowers,t2_4k362ufz,2020-09-17 09:42:11,0,9,You can make a random paper sticky by licking a rabbit.  
805,shittysuperpowers,t2_61o60jqc,2020-09-17 09:35:57,0,4,"You can give everyone synesthesia and mix up everyone's motor functions of everyone in a 100 kilometre radius, including yourself. Gives everyone EVERY form of synesthesia (your senses simulate your other sense, for example, you can HEAR colour or SMELL words).

Also, moving your arm opens your mouth, and it's random every time for each individual.

And if you use it, it's EVERYONE in an 100 kilometre distance, so you can't exclude people. That's 62 miles if you were wondering."
806,shittysuperpowers,t2_4614v22c,2020-09-17 09:35:22,3,4,You turn anything you touch brown. You have no control over it
807,shittysuperpowers,t2_2u8tnktx,2020-09-17 09:33:10,4,7,You can boost all your stats 3x the normal Your in a permanent loop of stat reset every week
808,shittysuperpowers,t2_3szkjlmo,2020-09-17 09:28:59,1,27,"If you run out of toilet paper when you're home alone, you can teleport a roll in to the room next door to the toilet  "
809,shittysuperpowers,t2_7e8obje9,2020-09-17 09:27:10,4,12,Your cum becomes blue when you're cheating on your partner.  
810,shittysuperpowers,t2_2u8tnktx,2020-09-17 09:26:46,0,3,You can now have a jojo battle every time you get banned If you win your unbanned if you lose your gonna be in the hospital
811,shittysuperpowers,t2_2u8tnktx,2020-09-17 09:24:07,1,3,You have powers of your favorite superhero And now as you used the power any person who wants you gone can do it by thinking about
812,shittysuperpowers,t2_7e8obje9,2020-09-17 08:47:35,3,56,You can remember the value of pi upto 50 digits randomly and not in order.  
813,shittysuperpowers,t2_7e8obje9,2020-09-17 08:46:02,2,16,Bass boosted windows xp sound plays every time you say something stupid  
814,shittysuperpowers,t2_7e8obje9,2020-09-17 08:41:33,7,11,"While watching porn, everytime you're about to jizz the guys face pops right up  "
815,shittysuperpowers,t2_15e8aj,2020-09-17 08:33:34,4,6,"When you point at a direction, the closest and smallest object in that direction will move aside.  "
816,shittysuperpowers,t2_3atgg0qg,2020-09-17 07:19:51,4,11,Porn Music Starts whenever take off any piece of clothing  
817,shittysuperpowers,t2_3n8r1yfc,2020-09-17 06:28:17,3,28,You now can partially command rodents  
818,shittysuperpowers,t2_3n8r1yfc,2020-09-17 06:26:03,1,8,You now can be telleported to random locations when you spin a wheel of places  
819,shittysuperpowers,t2_3n8r1yfc,2020-09-17 06:24:12,0,18,Your boner can point to the the nearest serial killer or muscle lady  
820,shittysuperpowers,t2_3n8r1yfc,2020-09-17 06:22:24,0,7,You now trigger claustrophobia in people closer than 6 feet from you Like full blown panic attacks
821,shittysuperpowers,t2_3n8r1yfc,2020-09-17 06:19:06,0,5,You now have a motivational poltergeist harassing you constantly and won't leave  
822,shittysuperpowers,t2_11h7dl,2020-09-17 06:17:31,1,8,You can make an eyelash get stuck in you eye whenever you want  
823,shittysuperpowers,t2_3n8r1yfc,2020-09-17 06:15:17,0,6,You now can give politicians final destination esq premonitions This will not cause death in most cases
824,shittysuperpowers,t2_3n8r1yfc,2020-09-17 06:13:02,3,3,You now can stick to almost any surface Unfortunately the ability to climb any surface is limited to your own strength
825,shittysuperpowers,t2_3n8r1yfc,2020-09-17 06:11:00,1,9,You now can throw your voice Only good for ventriloquist acts or scaring people
826,shittysuperpowers,t2_3n8r1yfc,2020-09-17 06:09:21,1,3,You now get slapped by Teddy Roosevelt when you are being a simp or show cowardice  
827,shittysuperpowers,t2_3n8r1yfc,2020-09-17 06:07:15,0,6,You now can modify covid 19 into super airborne rabies  
828,shittysuperpowers,t2_15e8aj,2020-09-17 05:45:01,0,5,"You can add ""angles"" to parts of your body. Swinging these parts at a high enough speed will turn them into blades.  "
829,shittysuperpowers,t2_15e8aj,2020-09-17 05:34:11,1,7,"You can manipulate cursors with your eyes. Closing your right eye activates the right mouse button, closing your left activates the left.  "
830,shittysuperpowers,t2_2u8tnktx,2020-09-17 05:14:52,391,5416,You can take any item from a video game It will only work as a cosmetic
831,shittysuperpowers,t2_6mwsprpp,2020-09-17 04:58:33,1,11,You can grow Shrek ears that immediately fall off and decompose.  
832,shittysuperpowers,t2_6mwsprpp,2020-09-17 04:52:34,1,23,"By opening a door, you can open a portal to a random location in Kalmanstunga, Iceland.  "
